-- phpMyAdmin SQL Dump
-- version 5.2.1
-- https://www.phpmyadmin.net/
--
-- Host: localhost:3306
-- Generation Time: Dec 14, 2025 at 12:44 AM
-- Server version: 5.7.23-23
-- PHP Version: 8.1.33

SET SQL_MODE = "NO_AUTO_VALUE_ON_ZERO";
START TRANSACTION;
SET time_zone = "+00:00";


/*!40101 SET @OLD_CHARACTER_SET_CLIENT=@@CHARACTER_SET_CLIENT */;
/*!40101 SET @OLD_CHARACTER_SET_RESULTS=@@CHARACTER_SET_RESULTS */;
/*!40101 SET @OLD_COLLATION_CONNECTION=@@COLLATION_CONNECTION */;
/*!40101 SET NAMES utf8mb4 */;

--
-- Database: `freewebs_ipromise`
--

-- --------------------------------------------------------

--
-- Table structure for table `ipromise_con`
--

CREATE TABLE `ipromise_con` (
  `id` int(11) NOT NULL,
  `name` varchar(50) DEFAULT NULL,
  `email` varchar(50) DEFAULT NULL,
  `phone_number` varchar(50) DEFAULT NULL,
  `msg_subject` varchar(200) DEFAULT NULL,
  `message` varchar(500) DEFAULT NULL
) ENGINE=InnoDB DEFAULT CHARSET=latin1;

--
-- Dumping data for table `ipromise_con`
--

INSERT INTO `ipromise_con` (`id`, `name`, `email`, `phone_number`, `msg_subject`, `message`) VALUES
(1, 'sathish', 'sathish13cs@gmail.com', '9994501750', 'test subject', 'test subject message body'),
(2, 'IPROMISE SOLUTIONS', 'ipromisesolutions@gmail.com', '9876543210', 'TEST EMAIL SUBJECT', 'TEST EMAIL BODY');

-- --------------------------------------------------------

--
-- Table structure for table `MAS_COMPANY`
--

CREATE TABLE `MAS_COMPANY` (
  `COMP_ID` mediumint(20) NOT NULL,
  `COMPANY_NAME` varchar(50) DEFAULT NULL,
  `COMP_EMAIL` varchar(50) DEFAULT NULL,
  `COMP_WEBSITE` varchar(50) DEFAULT NULL,
  `COMP_REGNO` varchar(20) DEFAULT NULL,
  `COMP_MOBILE` varchar(20) DEFAULT NULL,
  `WH_ADDRESS1` varchar(100) DEFAULT NULL,
  `WH_ADDRESS2` varchar(100) DEFAULT NULL,
  `WH_CITY` varchar(50) DEFAULT NULL,
  `WH_STATE` varchar(50) DEFAULT NULL,
  `WH_PINCODE` varchar(50) DEFAULT NULL
) ENGINE=InnoDB DEFAULT CHARSET=utf8mb4;

--
-- Dumping data for table `MAS_COMPANY`
--

INSERT INTO `MAS_COMPANY` (`COMP_ID`, `COMPANY_NAME`, `COMP_EMAIL`, `COMP_WEBSITE`, `COMP_REGNO`, `COMP_MOBILE`, `WH_ADDRESS1`, `WH_ADDRESS2`, `WH_CITY`, `WH_STATE`, `WH_PINCODE`) VALUES
(1, 'IPROMISE SOLUTIONS', 'support@flyingbees.com', 'www.udumalpet.com', 'REG:2025/02/19021996', '9994501750', '174, NEHRU STREET', 'PONDICHERRY   - 605001', NULL, NULL, '+91 93666 33344');

-- --------------------------------------------------------

--
-- Table structure for table `mas_customers`
--

CREATE TABLE `mas_customers` (
  `CUST_ID` int(11) NOT NULL,
  `CUST_NAME` varchar(100) NOT NULL,
  `CUST_MAIL` varchar(50) DEFAULT NULL,
  `CUST_MOBILE` varchar(20) DEFAULT NULL,
  `CUST_ADDRESS1` varchar(200) DEFAULT NULL,
  `CUST_ADDRESS2` varchar(200) DEFAULT NULL,
  `CUST_CITY` varchar(50) DEFAULT NULL,
  `CUST_STATE` varchar(50) DEFAULT NULL,
  `CUST_PINCODE` varchar(10) DEFAULT NULL,
  `CUST_GSTNO` varchar(20) DEFAULT NULL,
  `CUST_DESC` varchar(500) DEFAULT NULL,
  `CUST_TYPE` varchar(20) DEFAULT NULL,
  `CUST_WEBSITE` varchar(50) DEFAULT NULL,
  `CUST_STATUS` varchar(10) DEFAULT 'A',
  `CREATED_BY` varchar(20) NOT NULL,
  `CREATED_DATE` varchar(20) NOT NULL,
  `UPDATED_BY` varchar(20) DEFAULT NULL,
  `UPDATED_DATE` varchar(20) DEFAULT NULL,
  `INSERTED_URL` varchar(300) DEFAULT NULL
) ENGINE=InnoDB DEFAULT CHARSET=utf8mb4;

--
-- Dumping data for table `mas_customers`
--

INSERT INTO `mas_customers` (`CUST_ID`, `CUST_NAME`, `CUST_MAIL`, `CUST_MOBILE`, `CUST_ADDRESS1`, `CUST_ADDRESS2`, `CUST_CITY`, `CUST_STATE`, `CUST_PINCODE`, `CUST_GSTNO`, `CUST_DESC`, `CUST_TYPE`, `CUST_WEBSITE`, `CUST_STATUS`, `CREATED_BY`, `CREATED_DATE`, `UPDATED_BY`, `UPDATED_DATE`, `INSERTED_URL`) VALUES
(1, 'CUSTOMER B', 'SATHISH13CS@GMAIL.COM', '9994501750', '4/352 Bodipatti Pudur', 'S/o Kaviyarasu', 'Udumalpet', 'Tamil Nadu', '642154', NULL, '', NULL, NULL, 'A', '1', '2025-01-30', '1', '2025-01-30', 'fbaf1dd5feb1ce86fa6f38e6ee1435b15abda8acf0dfa121eceeabc203b213c5ae828eae08f3992596fe7073b4094c966a183c5608d4a6f2fe9c7e5c5cb8c7e2'),
(2, 'CUTOMER A', 'CUTOMERA@GMAIL.COM', '9685741230', 'Bodipatti WorkShop', 'Bodipatti (Post)', 'PALAKKAD', 'Tamil Nadu', '642154', NULL, '', NULL, NULL, 'A', '1', '2025-01-30', '1', '2025-01-30', '4358a30eae677945488d8a55b96dc4e3e5b1f87ab44905a64225fec28befd8c73f30dba37baaa2ff861c0dbfe5c573460fc9cf2d945c9e4087ff0af255ef2364');

-- --------------------------------------------------------

--
-- Table structure for table `mas_exptype`
--

CREATE TABLE `mas_exptype` (
  `EXP_ID` int(11) NOT NULL,
  `EXP_NAME` varchar(50) NOT NULL,
  `EXP_STATUS` varchar(50) DEFAULT '''A''',
  `CREATED_BY` varchar(50) NOT NULL,
  `CREATED_DATE` varchar(50) NOT NULL,
  `INSERTED_URL` varchar(500) DEFAULT NULL,
  `UPDATED_BY` varchar(50) DEFAULT NULL,
  `UPDATED_DATE` varchar(50) DEFAULT NULL
) ENGINE=InnoDB DEFAULT CHARSET=utf8mb4;

--
-- Dumping data for table `mas_exptype`
--

INSERT INTO `mas_exptype` (`EXP_ID`, `EXP_NAME`, `EXP_STATUS`, `CREATED_BY`, `CREATED_DATE`, `INSERTED_URL`, `UPDATED_BY`, `UPDATED_DATE`) VALUES
(1, 'TEA BILL', 'A', '1', '2025-01-30 15:46:25', '1933621d92cc75c2741758ec916019c7d93675773400e4cc442079d80c45d3303a007b104769dade81f9972b4af746713d7c288332728637bb2f4fec30c10427', NULL, NULL),
(2, 'FOOD BILL', 'A', '1', '2025-01-30 15:46:33', '7e8db1208902d44d160cfc4b94eabfa17c039ca0f172bf38dcb3a182a7613d3efae7e73e4db6a1d0bfaeb8fd903aa4d8ab888aeebd0c2cd98312afbc93725c05', NULL, NULL),
(3, 'electricity', 'A', '1', '2025-01-30 15:46:57', 'ab3d40f16f5168b7b39bb594eec8740a1821b446888d9e3d6a7953054b29bd0c1f2f128ac6fa75bf805fd38aa8d7b0f6dfc5cb35a14bfcab1061e3c413eaebcb', NULL, NULL),
(4, 'TRANSPORT', 'A', '1', '2025-01-30 15:47:10', '765e29ee4083e8f606bd68527840593bd34d2bed866f5226fb9ae9c9ab21a4ade50dc6e76428ffcae68686affcb73b4453b14fc906d28836fb731a3246edea8e', NULL, NULL),
(5, 'PAINTING', 'A', '1', '2025-01-30 15:47:25', 'c743ec47faa994881d13a72781771a373df1932f6e64112e5e55d983b0031276f1e2735b5f8544fa018d320660b1d79d51f84945f7e1c67cb1dea574934a7e93', NULL, NULL),
(6, 'WATER BILL', 'A', '1', '2025-01-30 15:48:03', '4cbaa8f29f3ca33f9db1d6bda2420d98e0f5709cb4371a40b92de99bc70de29789a2cc6f9ca7763f9163be446cd648021844ffd6b0557a31cf059e8085f63503', NULL, NULL);

-- --------------------------------------------------------

--
-- Table structure for table `mas_product`
--

CREATE TABLE `mas_product` (
  `PROD_ID` int(11) NOT NULL,
  `PROD_NAME` varchar(50) NOT NULL,
  `PROD_SHORTNAME` varchar(20) DEFAULT NULL,
  `PROD_DESC` varchar(200) NOT NULL,
  `PROD_STATUS` varchar(10) DEFAULT 'A',
  `PROD_TYPE` varchar(10) NOT NULL,
  `PROD_UOM` varchar(10) NOT NULL,
  `PROD_CATEGORY` varchar(20) NOT NULL,
  `PROD_RATE` decimal(18,2) NOT NULL,
  `CREATED_BY` varchar(20) NOT NULL,
  `PROD_GST` varchar(30) DEFAULT NULL,
  `CREATED_DATE` varchar(20) NOT NULL,
  `UPDATED_BY` varchar(20) DEFAULT NULL,
  `UPDATED_DATE` varchar(20) DEFAULT NULL,
  `INSERTED_URL` varchar(300) NOT NULL
) ENGINE=InnoDB DEFAULT CHARSET=utf8mb4;

-- --------------------------------------------------------

--
-- Table structure for table `mas_producttype`
--

CREATE TABLE `mas_producttype` (
  `TYPE_ID` int(11) NOT NULL,
  `TYPE_NAME` varchar(50) NOT NULL,
  `TYPE_STATUS` varchar(50) NOT NULL,
  `CREATED_BY` varchar(50) NOT NULL,
  `CREATED_DATE` varchar(50) NOT NULL
) ENGINE=InnoDB DEFAULT CHARSET=utf8mb4;

-- --------------------------------------------------------

--
-- Table structure for table `mas_project`
--

CREATE TABLE `mas_project` (
  `PROJ_ID` int(11) NOT NULL,
  `PROJ_NAME` varchar(100) NOT NULL,
  `PROJ_DESC` varchar(200) DEFAULT NULL,
  `PROJ_TYPE` varchar(50) DEFAULT NULL,
  `PROJ_STRDATE` varchar(20) DEFAULT NULL,
  `PROJ_ENDDATE` varchar(20) DEFAULT NULL,
  `PROJ_LOCATION` varchar(50) DEFAULT NULL,
  `PROJ_VALUE` decimal(18,2) DEFAULT NULL,
  `CUST_ID` varchar(50) DEFAULT NULL,
  `PROJ_STATUS` varchar(20) DEFAULT NULL,
  `CREATED_DATE` varchar(50) DEFAULT NULL,
  `CREATED_BY` varchar(50) DEFAULT NULL,
  `UPDATED_BY` varchar(20) DEFAULT NULL,
  `UPDATED_DATE` varchar(20) DEFAULT NULL,
  `INSERTED_URL` varchar(500) DEFAULT NULL,
  `COMPLETED_DATE` varchar(20) DEFAULT NULL
) ENGINE=InnoDB DEFAULT CHARSET=utf8mb4;

--
-- Dumping data for table `mas_project`
--

INSERT INTO `mas_project` (`PROJ_ID`, `PROJ_NAME`, `PROJ_DESC`, `PROJ_TYPE`, `PROJ_STRDATE`, `PROJ_ENDDATE`, `PROJ_LOCATION`, `PROJ_VALUE`, `CUST_ID`, `PROJ_STATUS`, `CREATED_DATE`, `CREATED_BY`, `UPDATED_BY`, `UPDATED_DATE`, `INSERTED_URL`, `COMPLETED_DATE`) VALUES
(1, 'WEB SITE FOR COMMUNITY', '', '1', '2025-01-30', '2025-03-13', 'COIMBATORE', 30000.00, '1', 'A', '2025-01-30 15:56:27', '1', NULL, NULL, '0b199bbcfcdbb69939f7c4a7f524901ce453f3d004ad132968ae05a456d3dbfde263926a20f93bd31ae46109812d32c83a8eb19f9cd194bb8bb60d1fe143fef1', NULL);

-- --------------------------------------------------------

--
-- Table structure for table `mas_projecttype`
--

CREATE TABLE `mas_projecttype` (
  `TYPE_ID` int(11) NOT NULL,
  `TYPE_NAME` varchar(255) DEFAULT NULL,
  `TYPE_STATUS` varchar(255) DEFAULT NULL,
  `CREATED_DATE` varchar(255) DEFAULT NULL,
  `CREATED_BY` varchar(20) DEFAULT NULL,
  `UPDATED_BY` varchar(20) DEFAULT NULL,
  `UPDATED_DATE` varchar(20) DEFAULT NULL,
  `INSERTED_URL` varchar(500) DEFAULT NULL
) ENGINE=InnoDB DEFAULT CHARSET=utf8mb4;

--
-- Dumping data for table `mas_projecttype`
--

INSERT INTO `mas_projecttype` (`TYPE_ID`, `TYPE_NAME`, `TYPE_STATUS`, `CREATED_DATE`, `CREATED_BY`, `UPDATED_BY`, `UPDATED_DATE`, `INSERTED_URL`) VALUES
(1, 'WEBSITE', 'A', '2025-01-30 15:44:26', '1', NULL, NULL, '224c7619a8d309a93c741448849fb98da8d1af40bd36d8e7175ca041ce9b296f129f3c97d36ea4aa233a860f6190024be5b050e2f5b320854207073011c01143'),
(2, 'MOBILE APPS', 'A', '2025-01-30 15:44:42', '1', NULL, NULL, '0a1320683b30b8990b2c28cc91a10ed934d6a38c797948c1dc688261032bcf239bc2aaca9d8dcd8c4e91f8083ff1d37930562b9f1ad0842782d85b86584db973'),
(3, 'WEB DESIGNER', 'A', '2025-01-30 15:45:07', '1', NULL, NULL, '63bfdc140c0f820c511f6681e7da8c1f8a01c34476720bdec89dceca8bb5d039791abc132894b8bd4390062395fad3d80c4232cc189b742bfd6d1474bee6717b'),
(4, 'GRAPH DESIGNER', 'A', '2025-01-30 15:45:22', '1', NULL, NULL, 'a007c5c4790a17b198134fd9ae56563f3207ad00463b9f8bd0b6e0dbd63d5d89fa4ee9a1bacbf8c437603a49c01d60b32230f0f0397054eb0612304d98e0d502'),
(5, 'SUPPORT DESK', 'A', '2025-01-30 15:45:38', '1', NULL, NULL, '91a4c7bd382d0e936bd7061d76fb4c4c00d684b83251050c543f8156ec961bc6b2a66f147c333ca896d8cc08d4d9d943a97d47fd2aef893be4f21d9979705c39'),
(6, 'HOUSE KEEPING', 'A', '2025-01-30 15:45:51', '1', NULL, NULL, 'dc975e0916373d68ba3bd2e63bc8075d4fc967f55a98638384e4f96c201e8716d8795287f7a3f129ad8fbda19b23f15da784263abf1fe5b018f9af8548ab1073');

-- --------------------------------------------------------

--
-- Table structure for table `MAS_USERS`
--

CREATE TABLE `MAS_USERS` (
  `USER_ID` int(11) NOT NULL,
  `USER_NAME` varchar(50) NOT NULL,
  `USER_EMAIL` varchar(50) DEFAULT NULL,
  `USER_MOBILE` varchar(12) DEFAULT NULL,
  `USER_EMGMOBILE` varchar(10) DEFAULT NULL,
  `USER_PASSWORD` varchar(50) DEFAULT NULL,
  `USER_DOB` varchar(20) DEFAULT NULL,
  `USER_DOJ` varchar(20) DEFAULT NULL,
  `USER_STATUS` varchar(10) DEFAULT 'A',
  `USER_TOKEN` varchar(200) DEFAULT NULL,
  `USER_TYPE` varchar(20) DEFAULT NULL,
  `USER_AADHAR` varchar(12) DEFAULT NULL,
  `USER_IP` varchar(100) DEFAULT NULL,
  `LAST_LOGIN` varchar(50) DEFAULT NULL,
  `USER_VEHICLE` varchar(12) DEFAULT NULL,
  `CREATED_BY` varchar(20) DEFAULT NULL,
  `CREATED_DATE` varchar(20) DEFAULT NULL,
  `INSERTED_URL` varchar(500) DEFAULT NULL,
  `UPDATED_BY` varchar(20) DEFAULT NULL,
  `UPDATED_DATE` varchar(20) DEFAULT NULL
) ENGINE=InnoDB DEFAULT CHARSET=utf8mb4;

--
-- Dumping data for table `MAS_USERS`
--

INSERT INTO `MAS_USERS` (`USER_ID`, `USER_NAME`, `USER_EMAIL`, `USER_MOBILE`, `USER_EMGMOBILE`, `USER_PASSWORD`, `USER_DOB`, `USER_DOJ`, `USER_STATUS`, `USER_TOKEN`, `USER_TYPE`, `USER_AADHAR`, `USER_IP`, `LAST_LOGIN`, `USER_VEHICLE`, `CREATED_BY`, `CREATED_DATE`, `INSERTED_URL`, `UPDATED_BY`, `UPDATED_DATE`) VALUES
(1, 'SUPER ADMIN', 'superadmin2025@rim.com', '000000', '000000', '$uber@bmin#@2025', '1996-12-07', '2024-12-05', 'A', '93b1c8915a0cda6c1d29e0f56c8db59f0c635ed50910e0e56216422769b2de087aa2aecb6c3ccf20fff1f04549aa98fdfa254c2c2f4fd9d71240b432e00d8e3e', '1', '123654789652', '106.192.167.116', '2025-12-08 11:49:12', 'TN78V9802', '1', '2025-01-03 09:46:38', 'super_admin', NULL, NULL),
(17, 'employee B', 'sathish13cs@gmail.com', '9994501750', '9865161859', '9994501750', '2025-01-30', '2025-01-30', 'A', '1b44dbd80e59ce4110c2ba933868cc952735e7e02422a5e4435fb4f3ebaa64fae98bad097dea9a7a9974c32f22d6ca2da647aaeeb2f64ba81c119cb1974e70fe', '3', '123456789000', '106.200.22.97', '2025-12-13 23:40:35', 'TN78V9802', '1', '2025-01-30 15:28:10', '4703a9489cb7742a12cfa2f600b23ebe524794adf903330ed866716f83843cd7dffa07a60e9a711b22dcca8d47e5ce4f74ce11d7b9ff88d5378bb50b16d87825', '1', '2025-01-30 15:37:16'),
(18, 'employee a', 'sathish13cs@gmail.com', '9994501752', '9865161859', '9994501752', '2025-01-30', '2025-01-30', 'A', 'c2bb894800268272fc8893723eb499d59cc832d728c4b2f85ddd44419c4160177d140fdc3c3199c28a981d275fb9c6d13c3d810a121440932ee8b00308300f43', '3', '123456789000', '::1', '2025-01-30 17:07:13', 'TN78V9802', '1', '2025-01-30 15:31:47', 'cbd699eba3f5342bbfe515923f99dbe131f8fd19043912422ef2b48d02a54140e1d76732136ee8534a22d47e4e9891bf7b0fee1fcb8cfdd472073fd0a5098946', '1', '2025-01-30 15:37:01');

-- --------------------------------------------------------

--
-- Table structure for table `MAS_USERSROLE`
--

CREATE TABLE `MAS_USERSROLE` (
  `ROLE_ID` int(11) NOT NULL,
  `ROLE_NAME` varchar(50) NOT NULL,
  `ROLE_DESC` varchar(50) NOT NULL,
  `ROLE_STATUS` varchar(50) NOT NULL,
  `CREATED_BY` varchar(20) NOT NULL,
  `CREATED_DATE` varchar(20) NOT NULL,
  `UPDATED_BY` varchar(20) DEFAULT NULL,
  `UPDATED_DATE` varchar(20) DEFAULT NULL
) ENGINE=InnoDB DEFAULT CHARSET=utf8mb4;

--
-- Dumping data for table `MAS_USERSROLE`
--

INSERT INTO `MAS_USERSROLE` (`ROLE_ID`, `ROLE_NAME`, `ROLE_DESC`, `ROLE_STATUS`, `CREATED_BY`, `CREATED_DATE`, `UPDATED_BY`, `UPDATED_DATE`) VALUES
(1, 'INSERT RIGHT ONLY', 'INSERT RIGHT ONLY', 'A', '2', '20-12-2024', '', ''),
(2, 'VIEW RIGHT ONLY', 'VIEW RIGHT ONLY', 'A', '2', '20-12-2024', '', ''),
(3, 'DELETE RIGHT ONLY', 'DELETE RIGHT ONLY', 'A', '1', '20-12-2024', '', ''),
(4, 'ADMIN RIGHT ONLY', 'ADMIN RIGHT ONLY', 'A', '2', '20-12-2024', '', '');

-- --------------------------------------------------------

--
-- Table structure for table `MAS_USERTYPE`
--

CREATE TABLE `MAS_USERTYPE` (
  `USER_TYPEID` int(11) NOT NULL,
  `TYPE_NAME` varchar(30) NOT NULL,
  `TYPE_STATUS` varchar(20) DEFAULT 'A'
) ENGINE=InnoDB DEFAULT CHARSET=utf8mb4;

--
-- Dumping data for table `MAS_USERTYPE`
--

INSERT INTO `MAS_USERTYPE` (`USER_TYPEID`, `TYPE_NAME`, `TYPE_STATUS`) VALUES
(1, 'SUPER ADMIN', 'A'),
(2, 'OFFICE ADMIN', 'A'),
(3, 'USERS', 'A'),
(4, 'SUPERVISOR', 'A');

-- --------------------------------------------------------

--
-- Table structure for table `MAS_WAREHOUSE`
--

CREATE TABLE `MAS_WAREHOUSE` (
  `WH_ID` int(11) NOT NULL,
  `WH_CODE` varchar(20) NOT NULL,
  `WH_NAME` varchar(50) NOT NULL,
  `WH_ADDRESS` varchar(100) DEFAULT NULL,
  `WH_ADDRESS1` varchar(300) DEFAULT NULL,
  `WH_CITY` varchar(50) DEFAULT NULL,
  `WH_STATE` varchar(50) DEFAULT NULL,
  `WH_PINCODE` varchar(10) DEFAULT NULL,
  `WH_PERSON` varchar(20) DEFAULT NULL,
  `WH_MOBILE` varchar(20) DEFAULT NULL,
  `WH_TYPE` varchar(10) NOT NULL,
  `WH_STATUS` varchar(10) NOT NULL,
  `CREATED_DATE` varchar(20) NOT NULL,
  `CREATED_BY` varchar(20) NOT NULL,
  `INSERTED_URL` varchar(300) NOT NULL,
  `UPDATED_BY` varchar(20) DEFAULT NULL,
  `UPDATED_DATE` varchar(20) DEFAULT NULL,
  `WH_DESC` varchar(300) DEFAULT NULL,
  `WH_GSTNO` varchar(20) DEFAULT NULL,
  `COMPANY_CODE` varchar(10) NOT NULL DEFAULT '1'
) ENGINE=InnoDB DEFAULT CHARSET=utf8mb4;

--
-- Dumping data for table `MAS_WAREHOUSE`
--

INSERT INTO `MAS_WAREHOUSE` (`WH_ID`, `WH_CODE`, `WH_NAME`, `WH_ADDRESS`, `WH_ADDRESS1`, `WH_CITY`, `WH_STATE`, `WH_PINCODE`, `WH_PERSON`, `WH_MOBILE`, `WH_TYPE`, `WH_STATUS`, `CREATED_DATE`, `CREATED_BY`, `INSERTED_URL`, `UPDATED_BY`, `UPDATED_DATE`, `WH_DESC`, `WH_GSTNO`, `COMPANY_CODE`) VALUES
(1, 'WH00001', 'GRACE FASHION WEAR PTE. LTD', '174 serangoon road', 'singapore-218053', 'ph:98677899', '', '', '', '6598677899', 'SUB', 'A', '14-04-2025 17:52:13', '1', '2229fdf3', NULL, NULL, '', NULL, '1'),
(2, 'WH00002', 'GRACE FASHION WEAR(pdy)', '174, nEHRU STREET, PONDICHERRY-605001', 'Ph: 9366633344', '', 'pondicherry', '605001', 'ravichandran', '9787095141', 'SUB', 'A', '16-07-2025 09:00:21', '1', '310bc611', NULL, NULL, '', NULL, '1');

-- --------------------------------------------------------

--
-- Table structure for table `mas_worktype`
--

CREATE TABLE `mas_worktype` (
  `WORKTYPE_ID` int(11) NOT NULL,
  `WORK_NAME` varchar(100) DEFAULT NULL,
  `CREATED_BY` varchar(100) DEFAULT NULL,
  `CREATED_DATE` varchar(100) DEFAULT NULL,
  `WORK_STATUS` varchar(10) NOT NULL DEFAULT 'A',
  `WORK_DESC` varchar(300) DEFAULT NULL
) ENGINE=InnoDB DEFAULT CHARSET=utf8mb4;

-- --------------------------------------------------------

--
-- Table structure for table `REPORT_ENTRIES`
--

CREATE TABLE `REPORT_ENTRIES` (
  `id` int(11) NOT NULL,
  `reportId` varchar(255) DEFAULT NULL,
  `orderBy` int(11) DEFAULT NULL,
  `field_name` varchar(255) DEFAULT NULL,
  `field_key` varchar(100) DEFAULT NULL,
  `html_value` longtext,
  `delta_value` longtext,
  `blog_type` varchar(10) DEFAULT '1',
  `status` varchar(255) NOT NULL DEFAULT 'A',
  `created_date` timestamp NOT NULL DEFAULT CURRENT_TIMESTAMP ON UPDATE CURRENT_TIMESTAMP
) ENGINE=InnoDB DEFAULT CHARSET=utf8mb4;

--
-- Dumping data for table `REPORT_ENTRIES`
--

INSERT INTO `REPORT_ENTRIES` (`id`, `reportId`, `orderBy`, `field_name`, `field_key`, `html_value`, `delta_value`, `blog_type`, `status`, `created_date`) VALUES
(1, 'abba-father', 0, 'Write Blog', 'Write Blog', '<h1>ABBA FATHER</h1><h2><br></h2><h2>Matthew 3:17 New King James Version</h2><p>17 And suddenly a voice came from heaven, saying, “This is My beloved Son, in whom I am well pleased.”</p><p><br></p><h2>Matthew 17:5 New King James Version</h2><p>5 While he was still speaking, behold, a bright cloud overshadowed them; and suddenly a voice came out of the cloud, saying, “This is My beloved Son, in whom I am well pleased. Hear Him!”</p><p><br></p><h2>Romans 8:19 New King James Version</h2><p>19 For the earnest expectation of the creation eagerly waits for the revealing of the sons of God.</p><p><br></p><p><strong>God willing the Holy Spirit will anoint JITHU CS to write in His time.</strong></p>', '{\"ops\":[{\"insert\":\"ABBA FATHER\"},{\"attributes\":{\"header\":1},\"insert\":\"\\n\"},{\"attributes\":{\"header\":2},\"insert\":\"\\n\"},{\"insert\":\"Matthew 3:17 New King James Version\"},{\"attributes\":{\"header\":2},\"insert\":\"\\n\"},{\"insert\":\"17 And suddenly a voice came from heaven, saying, \\u201cThis is My beloved Son, in whom I am well pleased.\\u201d\\n\\nMatthew 17:5 New King James Version\"},{\"attributes\":{\"header\":2},\"insert\":\"\\n\"},{\"insert\":\"5 While he was still speaking, behold, a bright cloud overshadowed them; and suddenly a voice came out of the cloud, saying, \\u201cThis is My beloved Son, in whom I am well pleased. Hear Him!\\u201d\\n\\nRomans 8:19 New King James Version\"},{\"attributes\":{\"header\":2},\"insert\":\"\\n\"},{\"insert\":\"19 For the earnest expectation of the creation eagerly waits for the revealing of the sons of God.\\n\\n\"},{\"attributes\":{\"bold\":true},\"insert\":\"God willing the Holy Spirit will anoint JITHU CS to write in His time.\"},{\"insert\":\"\\n\"}]}', '1', 'A', '2025-12-13 17:42:44'),
(2, 'jesus-christ', 0, 'Write Blog', 'Write Blog', '<h1>JESUS CHRIST</h1><p><br></p><h2>1 John 4:17</h2><p><br></p><p>New King James Version 17 Love has been perfected among us in this: that we may have boldness in the day of judgment; because as He is, so are we in this world.</p><h1><br></h1><h2>Romans 8:17</h2><p><br></p><p>New King James Version 17 and if children, then heirs—heirs of God and joint heirs with Christ, if indeed we suffer with Him, that we may also be glorified together.</p><h1><br></h1><h2>Romans 8:32</h2><p><br></p><p>New King James Version 32 He who did not spare His own Son, but delivered Him up for us all, how shall He not with Him also freely give us all things?</p><h1><br></h1><h3><strong>God willing the Holy Spirit will anoint JITHU CS to write in His time.</strong></h3>', '{\"ops\":[{\"insert\":\"JESUS CHRIST\"},{\"attributes\":{\"header\":1},\"insert\":\"\\n\"},{\"insert\":\"\\n1 John 4:17\"},{\"attributes\":{\"header\":2},\"insert\":\"\\n\"},{\"insert\":\"\\nNew King James Version 17 Love has been perfected among us in this: that we may have boldness in the day of judgment; because as He is, so are we in this world.\\n\"},{\"attributes\":{\"header\":1},\"insert\":\"\\n\"},{\"insert\":\"Romans 8:17\"},{\"attributes\":{\"header\":2},\"insert\":\"\\n\"},{\"insert\":\"\\nNew King James Version 17 and if children, then heirs\\u2014heirs of God and joint heirs with Christ, if indeed we suffer with Him, that we may also be glorified together.\\n\"},{\"attributes\":{\"header\":1},\"insert\":\"\\n\"},{\"insert\":\"Romans 8:32\"},{\"attributes\":{\"header\":2},\"insert\":\"\\n\"},{\"insert\":\"\\nNew King James Version 32 He who did not spare His own Son, but delivered Him up for us all, how shall He not with Him also freely give us all things?\\n\"},{\"attributes\":{\"header\":1},\"insert\":\"\\n\"},{\"attributes\":{\"bold\":true},\"insert\":\"God willing the Holy Spirit will anoint JITHU CS to write in His time.\"},{\"attributes\":{\"header\":3},\"insert\":\"\\n\"}]}', '1', 'A', '2025-12-13 17:49:06'),
(3, 'holy-spirit', 0, 'Write Blog', 'Write Blog', '<h1>HOLY SPIRIT</h1><p><br></p><h2>John 14:16-17 New King James Version</h2><p>16 And I will pray the Father, and He will give you another Helper, that He may abide with you forever— 17 the Spirit of truth, whom the world cannot receive, because it neither sees Him nor knows Him; but you know Him, for He dwells with you and will be in you.</p><p><br></p><h2>John 16:13-14 New King James Version</h2><p>13 However, when He, the Spirit of truth, has come, He will guide you into all truth; for He will not speak on His own authority, but whatever He hears He will speak; and He will tell you things to come. 14 He will glorify Me, for He will take of what is Mine and declare it to you.</p><p><br></p><h2>Acts 2:17-18 New King James Version</h2><p>17 ‘And it shall come to pass in the last days, says God, That I will pour out of My Spirit on all flesh; Your sons and your daughters shall prophesy, Your young men shall see visions, Your old men shall dream dreams. 18 And on My menservants and on My maidservants I will pour out My Spirit in those days; And they shall prophesy.</p><p><br></p><h3><strong>God willing the Holy Spirit will anoint JITHU CS to write in His time.</strong></h3>', '{\"ops\":[{\"insert\":\"HOLY SPIRIT\"},{\"attributes\":{\"header\":1},\"insert\":\"\\n\"},{\"insert\":\"\\nJohn 14:16-17 New King James Version\"},{\"attributes\":{\"header\":2},\"insert\":\"\\n\"},{\"insert\":\"16 And I will pray the Father, and He will give you another Helper, that He may abide with you forever\\u2014 17 the Spirit of truth, whom the world cannot receive, because it neither sees Him nor knows Him; but you know Him, for He dwells with you and will be in you.\\n\\nJohn 16:13-14 New King James Version\"},{\"attributes\":{\"header\":2},\"insert\":\"\\n\"},{\"insert\":\"13 However, when He, the Spirit of truth, has come, He will guide you into all truth; for He will not speak on His own authority, but whatever He hears He will speak; and He will tell you things to come. 14 He will glorify Me, for He will take of what is Mine and declare it to you.\\n\\nActs 2:17-18 New King James Version\"},{\"attributes\":{\"header\":2},\"insert\":\"\\n\"},{\"insert\":\"17 \\u2018And it shall come to pass in the last days, says God, That I will pour out of My Spirit on all flesh; Your sons and your daughters shall prophesy, Your young men shall see visions, Your old men shall dream dreams. 18 And on My menservants and on My maidservants I will pour out My Spirit in those days; And they shall prophesy.\\n\\n\"},{\"attributes\":{\"bold\":true},\"insert\":\"God willing the Holy Spirit will anoint JITHU CS to write in His time.\"},{\"attributes\":{\"header\":3},\"insert\":\"\\n\"}]}', '1', 'A', '2025-12-13 17:54:49');

-- --------------------------------------------------------

--
-- Table structure for table `REPORT_IMAGES`
--

CREATE TABLE `REPORT_IMAGES` (
  `id` int(11) NOT NULL,
  `reportId` varchar(255) DEFAULT NULL,
  `imagePath` varchar(255) DEFAULT NULL
) ENGINE=InnoDB DEFAULT CHARSET=utf8mb4;

--
-- Dumping data for table `REPORT_IMAGES`
--

INSERT INTO `REPORT_IMAGES` (`id`, `reportId`, `imagePath`) VALUES
(1, 'abba-father', '693da5946e366_1_ABBAFATHER (1).jpg'),
(2, 'jesus-christ', '693da671c826d_2_JESUS.jpg'),
(3, 'holy-spirit', '693da8037d52e_3_THE HOLY SPIRIt.jpg');

-- --------------------------------------------------------

--
-- Table structure for table `stk_transaction`
--

CREATE TABLE `stk_transaction` (
  `TRN_ID` int(11) NOT NULL,
  `TRN_CODE` varchar(20) DEFAULT NULL,
  `WH_FROMID` varchar(20) DEFAULT NULL,
  `WH_TOID` varchar(20) DEFAULT NULL,
  `NO_ITEMS` varchar(20) DEFAULT NULL,
  `CREATED_BY` varchar(20) DEFAULT NULL,
  `CREATED_DATE` varchar(20) DEFAULT NULL,
  `TRN_STATUS` varchar(3) DEFAULT 'A',
  `CUSTOMER_NAME` varchar(50) DEFAULT NULL,
  `CUSTOMER_MOBILE` varchar(15) DEFAULT NULL,
  `SUB_TOTAL` decimal(10,2) DEFAULT NULL,
  `TRN_TAX` decimal(10,2) DEFAULT NULL,
  `DISCOUNT` decimal(10,2) DEFAULT NULL,
  `SHIPPING` decimal(10,2) DEFAULT NULL,
  `TOTAL_AMT` decimal(10,2) DEFAULT NULL,
  `UPDATED_BY` varchar(20) DEFAULT NULL,
  `UPDATED_DATE` varchar(20) DEFAULT NULL,
  `SALES_PERSON` varchar(10) DEFAULT NULL,
  `IE_CODE` varchar(50) DEFAULT NULL,
  `LUT_CODE` varchar(50) DEFAULT NULL,
  `AD_CODE` varchar(50) DEFAULT NULL,
  `GOODS_ORIGIN` varchar(50) DEFAULT NULL,
  `FINAL_DEST` varchar(50) DEFAULT NULL,
  `MODE_PAYMENT` varchar(50) DEFAULT NULL,
  `VESSEL` varchar(50) DEFAULT NULL,
  `PORT_DIS` varchar(50) DEFAULT NULL,
  `SHIP_AGENT` varchar(50) DEFAULT NULL,
  `PORT_LOAD` varchar(50) DEFAULT NULL,
  `DELI_ADDRESS` text,
  `INVOICE_DATE` varchar(255) DEFAULT NULL
) ENGINE=InnoDB DEFAULT CHARSET=utf8mb4;

--
-- Dumping data for table `stk_transaction`
--

INSERT INTO `stk_transaction` (`TRN_ID`, `TRN_CODE`, `WH_FROMID`, `WH_TOID`, `NO_ITEMS`, `CREATED_BY`, `CREATED_DATE`, `TRN_STATUS`, `CUSTOMER_NAME`, `CUSTOMER_MOBILE`, `SUB_TOTAL`, `TRN_TAX`, `DISCOUNT`, `SHIPPING`, `TOTAL_AMT`, `UPDATED_BY`, `UPDATED_DATE`, `SALES_PERSON`, `IE_CODE`, `LUT_CODE`, `AD_CODE`, `GOODS_ORIGIN`, `FINAL_DEST`, `MODE_PAYMENT`, `VESSEL`, `PORT_DIS`, `SHIP_AGENT`, `PORT_LOAD`, `DELI_ADDRESS`, `INVOICE_DATE`) VALUES
(1, 'GRC0001/2025-26', 'all', '1', '38', '1', '14-04-2025 18:42:36', 'A', '', '', 644.00, 0.00, 0.00, 0.00, 644.00, NULL, NULL, '', '', '', '', NULL, '', '', '', '', '', '', '', '2025-04-14'),
(2, 'GRC0002/2025-26', 'all', '1', '23', '1', '15-04-2025 08:48:24', 'A', '', '', 537.90, 0.00, 0.00, 0.00, 537.90, NULL, NULL, '', '', '', '', NULL, '', '', '', '', '', '', '', '2025-04-15'),
(3, 'GRC0003/2025-26', 'all', '1', '27', '1', '15-04-2025 09:42:12', 'A', '', '', 783.00, 0.00, 0.00, 0.00, 783.00, NULL, NULL, '', '', '', '', NULL, '', '', '', '', '', '', '', '2025-04-15'),
(4, 'GRC0004/2025-26', 'all', '1', '47', '1', '15-04-2025 11:43:58', 'A', '', '', 1073.00, 0.00, 0.00, 0.00, 1073.00, NULL, NULL, '', '', '', '', NULL, '', '', '', '', '', '', '', '2025-04-15'),
(5, 'GRC0005/2025-26', '1', 'all', '3', '4', '15-04-2025 12:29:12', 'A', 'GRACE CUSTOMER', '92447989', 67.00, 0.00, 0.00, 0.00, 67.00, NULL, NULL, '5', '', '', '', NULL, '', '', '', '', '', '', '', '2025-04-15'),
(6, 'GRC0006/2025-26', 'all', '1', '25', '1', '15-04-2025 16:27:06', 'A', '', '', 655.00, 0.00, 0.00, 0.00, 655.00, NULL, NULL, '', '', '', '', NULL, '', '', '', '', '', '', '', '2025-04-15'),
(7, 'GRC0007/2025-26', 'all', '1', '71', '1', '16-04-2025 08:42:09', 'A', '', '', 3561.50, 0.00, 0.00, 0.00, 3561.50, NULL, NULL, '', '', '', '', NULL, '', '', '', '', '', '', '', '2025-04-16'),
(8, 'GRC0008/2025-26', 'all', '1', '39', '1', '16-04-2025 12:02:03', 'A', '', '', 1954.90, 0.00, 0.00, 0.00, 1954.90, NULL, NULL, '', '', '', '', NULL, '', '', '', '', '', '', '', '2025-04-16'),
(9, 'GRC0009/2025-26', 'all', '1', '38', '1', '16-04-2025 12:28:26', 'A', '', '', 1886.20, 0.00, 0.00, 0.00, 1886.20, NULL, NULL, '', '', '', '', NULL, '', '', '', '', '', '', '', '2025-04-16'),
(10, 'GRC0010/2025-26', 'all', '1', '27', '1', '16-04-2025 12:44:42', 'A', '', '', 1188.30, 0.00, 0.00, 0.00, 1188.30, NULL, NULL, '', '', '', '', NULL, '', '', '', '', '', '', '', '2025-04-16'),
(11, 'GRC0011/2025-26', 'all', '1', '39', '1', '16-04-2025 13:21:24', 'A', '', '', 1618.40, 0.00, 0.00, 0.00, 1618.40, NULL, NULL, '', '', '', '', NULL, '', '', '', '', '', '', '', '2025-04-16'),
(12, 'GRC0012/2025-26', 'all', '1', '57', '1', '16-04-2025 14:49:38', 'A', '', '', 1961.90, 0.00, 0.00, 0.00, 1961.90, NULL, NULL, '', '', '', '', NULL, '', '', '', '', '', '', '', '2025-04-16'),
(13, 'GRC0013/2025-26', 'all', '1', '1', '1', '16-04-2025 14:50:27', 'A', '', '', 29.00, 0.00, 0.00, 0.00, 29.00, NULL, NULL, '', '', '', '', NULL, '', '', '', '', '', '', '', '2025-04-16'),
(14, 'GRC0014/2025-26', 'all', '1', '4', '1', '16-04-2025 14:51:10', 'A', '', '', 116.00, 0.00, 0.00, 0.00, 116.00, NULL, NULL, '', '', '', '', NULL, '', '', '', '', '', '', '', '2025-04-16'),
(15, 'GRC0015/2025-26', '1', 'all', '4', '4', '16-04-2025 15:52:52', 'A', 'GRACE CUSTOMER', '92447989', 187.80, 0.00, 0.00, 0.00, 187.80, NULL, NULL, '5', '', '', '', NULL, '', '', '', '', '', '', '', '2025-04-16'),
(16, 'GRC0016/2025-26', '1', 'all', '1', '4', '17-04-2025 07:46:38', 'A', 'GRACE CUSTOMER', '92447989', 29.00, 0.00, 0.00, 0.00, 29.00, NULL, NULL, '5', '', '', '', NULL, '', '', '', '', '', '', '', '2025-04-17'),
(17, 'GRC0017/2025-26', 'all', '1', '55', '1', '17-04-2025 08:55:06', 'A', '', '', 1129.00, 0.00, 0.00, 0.00, 1129.00, NULL, NULL, '', '', '', '', NULL, '', '', '', '', '', '', '', '2025-04-17'),
(18, 'GRC0018/2025-26', 'all', '1', '93', '1', '17-04-2025 09:44:43', 'A', '', '', 1900.00, 0.00, 0.00, 0.00, 1900.00, NULL, NULL, '', '', '', '', NULL, '', '', '', '', '', '', '', '2025-04-17'),
(19, 'GRC0019/2025-26', 'all', '1', '134', '1', '17-04-2025 12:53:27', 'A', '', '', 3112.00, 0.00, 0.00, 0.00, 3112.00, NULL, NULL, '', '', '', '', NULL, '', '', '', '', '', '', '', '2025-04-17'),
(20, 'GRC0020/2025-26', '1', 'all', '5', '4', '17-04-2025 13:36:26', 'A', 'GRACE CUSTOMER', '92447989', 193.80, 0.00, 0.00, 0.00, 193.80, NULL, NULL, '5', '', '', '', NULL, '', '', '', '', '', '', '', '2025-04-17'),
(21, 'GRC0021/2025-26', 'all', '1', '50', '1', '17-04-2025 14:41:58', 'A', '', '', 1200.70, 0.00, 0.00, 0.00, 1200.70, NULL, NULL, '', '', '', '', NULL, '', '', '', '', '', '', '', '2025-04-17'),
(22, 'GRC0022/2025-26', 'all', '1', '62', '1', '17-04-2025 15:39:41', 'A', '', '', 1301.00, 0.00, 0.00, 0.00, 1301.00, NULL, NULL, '', '', '', '', NULL, '', '', '', '', '', '', '', '2025-04-17'),
(23, 'GRC0023/2025-26', 'all', '1', '36', '1', '17-04-2025 16:20:55', 'A', '', '', 770.00, 0.00, 0.00, 0.00, 770.00, NULL, NULL, '', '', '', '', NULL, '', '', '', '', '', '', '', '2025-04-17'),
(24, 'GRC0024/2025-26', 'all', '1', '63', '1', '17-04-2025 17:47:03', 'A', '', '', 1394.00, 0.00, 0.00, 0.00, 1394.00, NULL, NULL, '', '', '', '', NULL, '', '', '', '', '', '', '', '2025-04-17'),
(25, 'GRC0025/2025-26', 'all', '1', '51', '1', '17-04-2025 18:51:29', 'A', '', '', 1117.00, 0.00, 0.00, 0.00, 1117.00, NULL, NULL, '', '', '', '', NULL, '', '', '', '', '', '', '', '2025-04-17'),
(26, 'GRC0026/2025-26', '1', 'all', '5', '4', '18-04-2025 07:57:52', 'A', 'GRACE CUSTOMER', '92447989', 143.90, 0.00, 0.00, 0.00, 143.90, NULL, NULL, '5', '', '', '', NULL, '', '', '', '', '', '', '', '2025-04-18'),
(27, 'GRC0027/2025-26', 'all', '1', '83', '1', '18-04-2025 08:45:34', 'A', '', '', 1512.00, 0.00, 0.00, 0.00, 1512.00, NULL, NULL, '', '', '', '', NULL, '', '', '', '', '', '', '', '2025-04-18'),
(28, 'GRC0028/2025-26', '1', 'all', '8', '4', '18-04-2025 13:31:29', 'A', 'GRACE CUSTOMER', '92447989', 176.00, 0.00, 0.00, 0.00, 176.00, NULL, NULL, '5', '', '', '', NULL, '', '', '', '', '', '', '', '2025-04-18'),
(29, 'GRC0029/2025-26', 'all', '1', '16', '1', '18-04-2025 14:06:05', 'A', '', '', 290.00, 0.00, 0.00, 0.00, 290.00, NULL, NULL, '', '', '', '', NULL, '', '', '', '', '', '', '', '2025-04-18'),
(30, 'GRC0030/2025-26', '1', 'all', '13', '4', '18-04-2025 16:15:27', 'A', 'GRACE CUSTOMER', '92447989', 295.80, 0.00, 0.00, 0.00, 295.80, NULL, NULL, '5', '', '', '', NULL, '', '', '', '', '', '', '', '2025-04-18'),
(31, 'GRC0031/2025-26', '1', 'all', '7', '4', '18-04-2025 16:55:40', 'A', 'GRACE CUSTOMER', '92447989', 180.00, 0.00, 0.00, 0.00, 180.00, NULL, NULL, '5', '', '', '', NULL, '', '', '', '', '', '', '', '2025-04-18'),
(32, 'GRC0032/2025-26', '1', 'all', '3', '4', '18-04-2025 17:17:08', 'A', 'GRACE CUSTOMER', '92447989', 78.90, 0.00, 0.00, 0.00, 78.90, NULL, NULL, '5', '', '', '', NULL, '', '', '', '', '', '', '', '2025-04-18'),
(33, 'GRC0033/2025-26', 'all', '1', '64', '1', '19-04-2025 10:09:37', 'A', '', '', 1230.00, 0.00, 0.00, 0.00, 1230.00, NULL, NULL, '', '', '', '', NULL, '', '', '', '', '', '', '', '2025-04-19'),
(34, 'GRC0034/2025-26', '1', 'all', '13', '4', '19-04-2025 10:18:42', 'A', 'GRACE CUSTOMER', '92447989', 323.90, 0.00, 0.00, 0.00, 323.90, NULL, NULL, '6', '', '', '', NULL, '', '', '', '', '', '', '', '2025-04-19'),
(35, 'GRC0035/2025-26', '1', 'all', '1', '4', '19-04-2025 10:25:07', 'A', 'GRACE CUSTOMER', '92447989', 25.00, 0.00, 0.00, 0.00, 25.00, NULL, NULL, '6', '', '', '', NULL, '', '', '', '', '', '', '', '2025-04-19'),
(36, 'GRC0036/2025-26', '1', 'all', '22', '4', '22-04-2025 11:40:40', 'A', 'GRACE CUSTOMER', '92447989', 548.70, 0.00, 0.00, 0.00, 548.70, NULL, NULL, '6', '', '', '', NULL, '', '', '', '', '', '', '', '2025-04-22'),
(37, 'GRC0037/2025-26', '1', 'all', '6', '4', '22-04-2025 12:04:24', 'A', 'GRACE CUSTOMER', '92447989', 125.00, 0.00, 0.00, 0.00, 125.00, NULL, NULL, '5', '', '', '', NULL, '', '', '', '', '', '', '', '2025-04-22'),
(38, 'GRC0038/2025-26', 'all', '1', '292', '1', '22-04-2025 16:47:28', 'A', '', '', 8479.30, 0.00, 0.00, 0.00, 8479.30, NULL, NULL, '', '', '', '', NULL, '', '', '', '', '', '', '', '2025-04-22'),
(39, 'GRC0039/2025-26', 'all', '1', '1066', '1', '22-04-2025 17:42:24', 'A', '', '', 22044.70, 0.00, 0.00, 0.00, 22044.70, NULL, NULL, '', '', '', '', NULL, '', '', '', '', '', '', '', '2025-04-22'),
(40, 'GRC0040/2025-26', '1', 'all', '55', '4', '23-04-2025 08:14:15', 'A', 'GRACE CUSTOMER', '92447989', 1285.20, 0.00, 0.00, 0.00, 1285.20, NULL, NULL, '5', '', '', '', NULL, '', '', '', '', '', '', '', '2025-04-23'),
(41, 'GRC0041/2025-26', '1', 'all', '13', '4', '23-04-2025 08:17:08', 'A', 'GRACE CUSTOMER', '92447989', 441.30, 0.00, 0.00, 0.00, 441.30, NULL, NULL, '6', '', '', '', NULL, '', '', '', '', '', '', '', '2025-04-23'),
(42, 'GRC0042/2025-26', 'all', '1', '23', '1', '23-04-2025 09:47:03', 'A', '', '', 276.00, 0.00, 0.00, 0.00, 276.00, NULL, NULL, '', '', '', '', NULL, '', '', '', '', '', '', '', '2025-04-23'),
(43, 'GRC0043/2025-26', 'all', '1', '30', '1', '23-04-2025 13:50:57', 'A', '', '', 360.00, 0.00, 0.00, 0.00, 360.00, NULL, NULL, '', '', '', '', NULL, '', '', '', '', '', '', '', '2025-04-23'),
(44, 'GRC0044/2025-26', '1', 'all', '21', '4', '23-04-2025 15:56:11', 'A', 'GRACE CUSTOMER', '92447989', 502.20, 0.00, 0.00, 0.00, 502.20, NULL, NULL, '6', '', '', '', NULL, '', '', '', '', '', '', '', '2025-04-23'),
(45, 'GRC0045/2025-26', 'all', '1', '92', '1', '23-04-2025 16:43:23', 'A', '', '', 1380.00, 0.00, 0.00, 0.00, 1380.00, NULL, NULL, '', '', '', '', NULL, '', '', '', '', '', '', '', '2025-04-23'),
(46, 'GRC0046/2025-26', '1', 'all', '6', '4', '23-04-2025 17:43:58', 'A', 'GRACE CUSTOMER', '92447989', 200.50, 0.00, 0.00, 0.00, 200.50, NULL, NULL, '5', '', '', '', NULL, '', '', '', '', '', '', '', '2025-04-23'),
(47, 'GRC0047/2025-26', 'all', '1', '119', '1', '24-04-2025 08:35:22', 'A', '', '', 2402.00, 0.00, 0.00, 0.00, 2402.00, NULL, NULL, '', '', '', '', NULL, '', '', '', '', '', '', '', '2025-04-24'),
(48, 'GRC0048/2025-26', 'all', '1', '167', '1', '24-04-2025 13:31:11', 'A', '', '', 3329.00, 0.00, 0.00, 0.00, 3329.00, NULL, NULL, '', '', '', '', NULL, '', '', '', '', '', '', '', '2025-04-24'),
(49, 'GRC0049/2025-26', 'all', '1', '70', '1', '24-04-2025 14:59:41', 'A', '', '', 2319.90, 0.00, 0.00, 0.00, 2319.90, NULL, NULL, '', '', '', '', NULL, '', '', '', '', '', '', '', '2025-04-24'),
(50, 'GRC0050/2025-26', '1', 'all', '21', '4', '24-04-2025 15:07:17', 'A', 'GRACE CUSTOMER', '92447989', 456.80, 0.00, 0.00, 0.00, 456.80, NULL, NULL, '6', '', '', '', NULL, '', '', '', '', '', '', '', '2025-04-24'),
(51, 'GRC0051/2025-26', '1', 'all', '3', '4', '24-04-2025 15:28:03', 'A', 'GRACE CUSTOMER', '92447989', 67.00, 0.00, 0.00, 0.00, 67.00, NULL, NULL, '7', '', '', '', NULL, '', '', '', '', '', '', '', '2025-04-24'),
(52, 'GRC0052/2025-26', '1', 'all', '2', '4', '24-04-2025 16:08:10', 'A', 'GRACE CUSTOMER', '92447989', 53.90, 0.00, 0.00, 0.00, 53.90, NULL, NULL, '7', '', '', '', NULL, '', '', '', '', '', '', '', '2025-04-24'),
(53, 'GRC0053/2025-26', '1', 'all', '2', '4', '24-04-2025 16:38:42', 'A', 'GRACE CUSTOMER', '92447989', 48.00, 0.00, 0.00, 0.00, 48.00, NULL, NULL, '7', '', '', '', NULL, '', '', '', '', '', '', '', '2025-04-24'),
(54, 'GRC0054/2025-26', '1', 'all', '8', '4', '24-04-2025 18:34:05', 'A', 'GRACE CUSTOMER', '92447989', 218.70, 0.00, 0.00, 0.00, 218.70, NULL, NULL, '7', '', '', '', NULL, '', '', '', '', '', '', '', '2025-04-24'),
(55, 'GRC0055/2025-26', '1', 'all', '2', '4', '24-04-2025 18:37:55', 'A', 'GRACE CUSTOMER', '92447989', 49.00, 0.00, 0.00, 0.00, 49.00, NULL, NULL, '7', '', '', '', NULL, '', '', '', '', '', '', '', '2025-04-24'),
(56, 'GRC0056/2025-26', 'all', '1', '18', '1', '25-04-2025 08:43:33', 'A', '', '', 296.00, 0.00, 0.00, 0.00, 296.00, NULL, NULL, '', '', '', '', NULL, '', '', '', '', '', '', '', '2025-04-25'),
(57, 'GRC0057/2025-26', '1', 'all', '22', '4', '25-04-2025 16:27:29', 'A', 'GRACE CUSTOMER', '92447989', 525.50, 0.00, 0.00, 0.00, 525.50, NULL, NULL, '5', '', '', '', NULL, '', '', '', '', '', '', '', '2025-04-25'),
(58, 'GRC0058/2025-26', '1', 'all', '18', '4', '25-04-2025 18:48:14', 'A', 'GRACE CUSTOMER', '92447989', 425.00, 0.00, 0.00, 0.00, 425.00, NULL, NULL, '6', '', '', '', NULL, '', '', '', '', '', '', '', '2025-04-25'),
(59, 'GRC0059/2025-26', '1', 'all', '18', '4', '26-04-2025 11:30:18', 'A', 'GRACE CUSTOMER', '92447989', 420.60, 0.00, 0.00, 0.00, 420.60, NULL, NULL, '6', '', '', '', NULL, '', '', '', '', '', '', '', '2025-04-26'),
(60, 'GRC0060/2025-26', '1', 'all', '20', '4', '26-04-2025 18:09:30', 'A', 'GRACE CUSTOMER', '92447989', 510.60, 0.00, 0.00, 0.00, 510.60, NULL, NULL, '7', '', '', '', NULL, '', '', '', '', '', '', '', '2025-04-26'),
(61, 'GRC0061/2025-26', '1', 'all', '15', '4', '27-04-2025 08:18:59', 'A', 'GRACE CUSTOMER', '92447989', 311.60, 0.00, 0.00, 0.00, 311.60, NULL, NULL, '6', '', '', '', NULL, '', '', '', '', '', '', '', '2025-04-27'),
(62, 'GRC0062/2025-26', '1', 'all', '12', '4', '27-04-2025 08:21:46', 'A', 'GRACE CUSTOMER', '92447989', 285.70, 0.00, 0.00, 0.00, 285.70, NULL, NULL, '6', '', '', '', NULL, '', '', '', '', '', '', '', '2025-04-27'),
(63, 'GRC0063/2025-26', '1', 'all', '10', '4', '27-04-2025 13:50:37', 'A', 'GRACE CUSTOMER', '92447989', 230.00, 0.00, 0.00, 0.00, 230.00, NULL, NULL, '6', '', '', '', NULL, '', '', '', '', '', '', '', '2025-04-27'),
(64, 'GRC0064/2025-26', '1', 'all', '12', '4', '27-04-2025 13:54:29', 'A', 'GRACE CUSTOMER', '92447989', 244.80, 0.00, 0.00, 0.00, 244.80, NULL, NULL, '5', '', '', '', NULL, '', '', '', '', '', '', '', '2025-04-27'),
(65, 'GRC0065/2025-26', '1', 'all', '8', '4', '27-04-2025 15:55:21', 'A', 'GRACE CUSTOMER', '92447989', 158.80, 0.00, 0.00, 0.00, 158.80, NULL, NULL, '7', '', '', '', NULL, '', '', '', '', '', '', '', '2025-04-27'),
(66, 'GRC0066/2025-26', '1', 'all', '6', '4', '27-04-2025 15:57:14', 'A', 'GRACE CUSTOMER', '92447989', 143.90, 0.00, 0.00, 0.00, 143.90, NULL, NULL, '7', '', '', '', NULL, '', '', '', '', '', '', '', '2025-04-27'),
(67, 'GRC0067/2025-26', '1', 'all', '27', '4', '28-04-2025 12:51:32', 'A', 'GRACE CUSTOMER', '', 623.20, 0.00, 0.00, 0.00, 623.20, NULL, NULL, '6', '', '', '', NULL, '', '', '', '', '', '', '', '2025-04-28'),
(68, 'GRC0068/2025-26', '1', 'all', '1', '4', '28-04-2025 12:52:39', 'A', 'GRACE CUSTOMER', '', 29.00, 0.00, 0.00, 0.00, 29.00, NULL, NULL, '6', '', '', '', NULL, '', '', '', '', '', '', '', '2025-04-28'),
(69, 'GRC0069/2025-26', '1', 'all', '6', '4', '28-04-2025 15:19:39', 'A', 'GRACE CUSTOMER', '', 159.90, 0.00, 0.00, 0.00, 159.90, NULL, NULL, '6', '', '', '', NULL, '', '', '', '', '', '', '', '2025-04-28'),
(70, 'GRC0070/2025-26', '1', 'all', '7', '4', '28-04-2025 16:15:58', 'A', 'GRACE CUSTOMER', '', 238.90, 0.00, 0.00, 0.00, 238.90, NULL, NULL, '5', '', '', '', NULL, '', '', '', '', '', '', '', '2025-04-28'),
(71, 'GRC0071/2025-26', '1', 'all', '9', '4', '28-04-2025 18:17:34', 'A', 'GRACE CUSTOMER', '', 163.00, 0.00, 0.00, 0.00, 163.00, NULL, NULL, '5', '', '', '', NULL, '', '', '', '', '', '', '', '2025-04-28'),
(72, 'GRC0072/2025-26', '1', 'all', '9', '4', '28-04-2025 18:21:44', 'A', 'GRACE CUSTOMER', '', 183.00, 0.00, 0.00, 0.00, 183.00, NULL, NULL, '5', '', '', '', NULL, '', '', '', '', '', '', '', '2025-04-28'),
(73, 'GRC0073/2025-26', '1', 'all', '2', '4', '29-04-2025 08:09:39', 'A', 'GRACE CUSTOMER', '', 63.90, 0.00, 0.00, 0.00, 63.90, NULL, NULL, '5', '', '', '', NULL, '', '', '', '', '', '', '', '2025-04-29'),
(74, 'GRC0074/2025-26', '1', 'all', '27', '4', '29-04-2025 14:48:09', 'A', 'GRACE CUSTOMER', '', 634.50, 0.00, 0.00, 0.00, 634.50, NULL, NULL, '5', '', '', '', NULL, '', '', '', '', '', '', '', '2025-04-29'),
(75, 'GRC0075/2025-26', '1', 'all', '10', '4', '29-04-2025 14:50:03', 'A', 'GRACE CUSTOMER', '', 257.70, 0.00, 0.00, 0.00, 257.70, NULL, NULL, '5', '', '', '', NULL, '', '', '', '', '', '', '', '2025-04-29'),
(76, 'GRC0076/2025-26', '1', 'all', '2', '4', '29-04-2025 14:52:37', 'A', 'GRACE CUSTOMER', '', 34.90, 0.00, 0.00, 0.00, 34.90, NULL, NULL, '5', '', '', '', NULL, '', '', '', '', '', '', '', '2025-04-29'),
(77, 'GRC0077/2025-26', '1', 'all', '2', '4', '29-04-2025 14:53:49', 'A', 'GRACE CUSTOMER', '', 30.00, 0.00, 0.00, 0.00, 30.00, NULL, NULL, '5', '', '', '', NULL, '', '', '', '', '', '', '', '2025-04-29'),
(78, 'GRC0078/2025-26', '1', 'all', '1', '4', '29-04-2025 14:56:03', 'A', 'GRACE CUSTOMER', '', 29.00, 0.00, 0.00, 0.00, 29.00, NULL, NULL, '5', '', '', '', NULL, '', '', '', '', '', '', '', '2025-04-29'),
(79, 'GRC0079/2025-26', '1', 'all', '10', '4', '29-04-2025 18:31:57', 'A', 'GRACE CUSTOMER', '', 249.70, 0.00, 0.00, 0.00, 249.70, NULL, NULL, '5', '', '', '', NULL, '', '', '', '', '', '', '', '2025-04-29'),
(80, 'GRC0080/2025-26', '1', 'all', '3', '4', '29-04-2025 18:32:56', 'A', 'GRACE CUSTOMER', '', 79.00, 0.00, 0.00, 0.00, 79.00, NULL, NULL, '5', '', '', '', NULL, '', '', '', '', '', '', '', '2025-04-29'),
(81, 'GRC0081/2025-26', 'all', '1', '95', '1', '30-04-2025 10:31:17', 'A', '', '', 1540.00, 0.00, 0.00, 0.00, 1540.00, NULL, NULL, '', '', '', '', NULL, '', '', '', '', '', '', '', '2025-04-30'),
(82, 'GRC0082/2025-26', '1', 'all', '15', '4', '30-04-2025 10:35:38', 'A', 'GRACE CUSTOMER', '', 353.30, 0.00, 0.00, 0.00, 353.30, NULL, NULL, '6', '', '', '', NULL, '', '', '', '', '', '', '', '2025-04-30'),
(83, 'GRC0083/2025-26', '1', 'all', '9', '4', '30-04-2025 10:40:22', 'A', 'GRACE CUSTOMER', '', 215.70, 0.00, 0.00, 0.00, 215.70, NULL, NULL, '5', '', '', '', NULL, '', '', '', '', '', '', '', '2025-04-30'),
(84, 'GRC0084/2025-26', '1', 'all', '4', '4', '30-04-2025 10:41:10', 'A', 'GRACE CUSTOMER', '', 91.90, 0.00, 0.00, 0.00, 91.90, NULL, NULL, '7', '', '', '', NULL, '', '', '', '', '', '', '', '2025-04-30'),
(85, 'GRC0085/2025-26', '1', 'all', '11', '4', '30-04-2025 11:29:56', 'A', 'GRACE CUSTOMER', '', 293.70, 0.00, 0.00, 0.00, 293.70, NULL, NULL, '5', '', '', '', NULL, '', '', '', '', '', '', '', '2025-04-30'),
(86, 'GRC0086/2025-26', '1', 'all', '9', '4', '30-04-2025 13:24:23', 'A', 'GRACE CUSTOMER', '', 213.70, 0.00, 0.00, 0.00, 213.70, NULL, NULL, '6', '', '', '', NULL, '', '', '', '', '', '', '', '2025-04-30'),
(87, 'GRC0087/2025-26', 'all', '1', '169', '1', '02-05-2025 09:59:23', 'A', 'GRACE CUSTOMER', '', 3375.00, 0.00, 0.00, 0.00, 3375.00, NULL, NULL, '', '', '', '', NULL, '', '', '', '', '', '', '', '2025-05-02'),
(88, 'GRC0088/2025-26', '1', 'all', '6', '4', '02-05-2025 11:02:44', 'A', 'GRACE CUSTOMER', '', 118.00, 0.00, 0.00, 0.00, 118.00, NULL, NULL, '5', '', '', '', NULL, '', '', '', '', '', '', '', '2025-05-02'),
(89, 'GRC0089/2025-26', '1', 'all', '4', '4', '02-05-2025 11:04:30', 'A', 'GRACE CUSTOMER', '', 99.00, 0.00, 0.00, 0.00, 99.00, NULL, NULL, '5', '', '', '', NULL, '', '', '', '', '', '', '', '2025-05-02'),
(90, 'GRC0090/2025-26', '1', 'all', '7', '4', '02-05-2025 11:07:57', 'A', 'GRACE CUSTOMER', '', 210.80, 0.00, 0.00, 0.00, 210.80, NULL, NULL, '5', '', '', '', NULL, '', '', '', '', '', '', '', '2025-05-02'),
(91, 'GRC0091/2025-26', '1', 'all', '9', '4', '02-05-2025 11:47:47', 'A', 'GRACE CUSTOMER', '', 214.00, 0.00, 0.00, 0.00, 214.00, NULL, NULL, '6', '', '', '', NULL, '', '', '', '', '', '', '', '2025-05-02'),
(92, 'GRC0092/2025-26', '1', 'all', '17', '4', '02-05-2025 12:11:33', 'A', 'GRACE CUSTOMER', '', 390.50, 0.00, 0.00, 0.00, 390.50, NULL, NULL, '6', '', '', '', NULL, '', '', '', '', '', '', '', '2025-05-02'),
(93, 'GRC0093/2025-26', '1', 'all', '9', '4', '02-05-2025 12:16:39', 'A', 'GRACE CUSTOMER', '', 196.70, 0.00, 0.00, 0.00, 196.70, NULL, NULL, '5', '', '', '', NULL, '', '', '', '', '', '', '', '2025-05-02'),
(94, 'GRC0094/2025-26', '1', 'all', '10', '4', '02-05-2025 12:19:08', 'A', 'GRACE CUSTOMER', '', 245.70, 0.00, 0.00, 0.00, 245.70, NULL, NULL, '5', '', '', '', NULL, '', '', '', '', '', '', '', '2025-05-02'),
(95, 'GRC0095/2025-26', '1', 'all', '9', '4', '02-05-2025 13:03:19', 'A', 'GRACE CUSTOMER', '', 181.00, 0.00, 0.00, 0.00, 181.00, NULL, NULL, '5', '', '', '', NULL, '', '', '', '', '', '', '', '2025-05-02'),
(96, 'GRC0096/2025-26', '1', 'all', '9', '4', '02-05-2025 13:05:53', 'A', 'GRACE CUSTOMER', '', 273.80, 0.00, 0.00, 0.00, 273.80, NULL, NULL, '5', '', '', '', NULL, '', '', '', '', '', '', '', '2025-05-02'),
(97, 'GRC0097/2025-26', '1', 'all', '10', '4', '02-05-2025 13:08:23', 'A', 'GRACE CUSTOMER', '', 285.60, 0.00, 0.00, 0.00, 285.60, NULL, NULL, '5', '', '', '', NULL, '', '', '', '', '', '', '', '2025-05-02'),
(98, 'GRC0098/2025-26', '1', 'all', '14', '4', '02-05-2025 13:12:17', 'A', 'GRACE CUSTOMER', '', 303.60, 0.00, 0.00, 0.00, 303.60, NULL, NULL, '5', '', '', '', NULL, '', '', '', '', '', '', '', '2025-05-02'),
(99, 'GRC0099/2025-26', '1', 'all', '3', '4', '02-05-2025 13:41:55', 'A', 'GRACE CUSTOMER', '', 71.80, 0.00, 0.00, 0.00, 71.80, NULL, NULL, '5', '', '', '', NULL, '', '', '', '', '', '', '', '2025-05-02'),
(100, 'GRC0100/2025-26', '1', 'all', '1', 'UNKNOWN', '02-05-2025 13:47:03', 'A', 'GRACE CUSTOMER', '', 29.00, 0.00, 0.00, 0.00, 29.00, NULL, NULL, '5', '', '', '', NULL, '', '', '', '', '', '', '', '2025-05-02'),
(101, 'GRC0101/2025-26', '1', 'all', '11', '4', '02-05-2025 18:48:12', 'A', 'GRACE CUSTOMER', '', 235.80, 0.00, 0.00, 0.00, 235.80, NULL, NULL, '5', '', '', '', NULL, '', '', '', '', '', '', '', '2025-05-02'),
(102, 'GRC0102/2025-26', '1', 'all', '8', '4', '02-05-2025 18:49:55', 'A', 'GRACE CUSTOMER', '', 148.00, 0.00, 0.00, 0.00, 148.00, NULL, NULL, '5', '', '', '', NULL, '', '', '', '', '', '', '', '2025-05-02'),
(103, 'GRC0103/2025-26', '1', 'all', '8', '4', '03-05-2025 12:44:22', 'A', 'GRACE CUSTOMER', '', 229.60, 0.00, 0.00, 0.00, 229.60, NULL, NULL, '5', '', '', '', NULL, '', '', '', '', '', '', '', '2025-05-03'),
(104, 'GRC0104/2025-26', '1', 'all', '7', '4', '03-05-2025 12:45:43', 'A', 'GRACE CUSTOMER', '', 180.70, 0.00, 0.00, 0.00, 180.70, NULL, NULL, '5', '', '', '', NULL, '', '', '', '', '', '', '', '2025-05-03'),
(105, 'GRC0105/2025-26', '1', 'all', '8', '4', '03-05-2025 14:30:15', 'A', 'GRACE CUSTOMER', '', 195.90, 0.00, 0.00, 0.00, 195.90, NULL, NULL, '5', '', '', '', NULL, '', '', '', '', '', '', '', '2025-05-03'),
(106, 'GRC0106/2025-26', '1', 'all', '1', '4', '03-05-2025 14:46:06', 'A', 'GRACE CUSTOMER', '', 20.00, 0.00, 0.00, 0.00, 20.00, NULL, NULL, '7', '', '', '', NULL, '', '', '', '', '', '', '', '2025-05-03'),
(107, 'GRC0107/2025-26', '1', 'all', '1', '4', '03-05-2025 16:08:45', 'A', 'GRACE CUSTOMER', '', 19.00, 0.00, 0.00, 0.00, 19.00, NULL, NULL, '5', '', '', '', NULL, '', '', '', '', '', '', '', '2025-05-03'),
(108, 'GRC0108/2025-26', '1', 'all', '1', '4', '03-05-2025 16:24:02', 'A', 'GRACE CUSTOMER', '', 15.00, 0.00, 0.00, 0.00, 15.00, NULL, NULL, '5', '', '', '', NULL, '', '', '', '', '', '', '', '2025-05-03'),
(109, 'GRC0109/2025-26', '1', 'all', '1', '4', '03-05-2025 17:35:20', 'A', 'GRACE CUSTOMER', '', 27.00, 0.00, 0.00, 0.00, 27.00, NULL, NULL, '5', '', '', '', NULL, '', '', '', '', '', '', '', '2025-05-03'),
(110, 'GRC0110/2025-26', '1', 'all', '4', '4', '04-05-2025 07:52:35', 'A', 'GRACE CUSTOMER', '', 86.00, 0.00, 0.00, 0.00, 86.00, NULL, NULL, '5', '', '', '', NULL, '', '', '', '', '', '', '', '2025-05-04'),
(111, 'GRC0111/2025-26', '1', 'all', '5', '4', '04-05-2025 11:33:01', 'A', 'GRACE CUSTOMER', '', 103.90, 0.00, 0.00, 0.00, 103.90, NULL, NULL, '5', '', '', '', NULL, '', '', '', '', '', '', '', '2025-05-04'),
(112, 'GRC0112/2025-26', '1', 'all', '11', '4', '04-05-2025 11:47:37', 'A', 'GRACE CUSTOMER', '', 264.70, 0.00, 0.00, 0.00, 264.70, NULL, NULL, '6', '', '', '', NULL, '', '', '', '', '', '', '', '2025-05-04'),
(113, 'GRC0113/2025-26', '1', 'all', '12', '4', '04-05-2025 12:11:16', 'A', 'GRACE CUSTOMER', '', 256.80, 0.00, 0.00, 0.00, 256.80, NULL, NULL, '6', '', '', '', NULL, '', '', '', '', '', '', '', '2025-05-04'),
(114, 'GRC0114/2025-26', '1', 'all', '6', '4', '04-05-2025 12:12:51', 'A', 'GRACE CUSTOMER', '', 235.70, 0.00, 0.00, 0.00, 235.70, NULL, NULL, '5', '', '', '', NULL, '', '', '', '', '', '', '', '2025-05-04'),
(115, 'GRC0115/2025-26', '1', 'all', '5', '4', '04-05-2025 12:14:46', 'A', 'GRACE CUSTOMER', '', 94.70, 0.00, 0.00, 0.00, 94.70, NULL, NULL, '5', '', '', '', NULL, '', '', '', '', '', '', '', '2025-05-04'),
(116, 'GRC0116/2025-26', '1', 'all', '5', '4', '04-05-2025 13:20:55', 'A', 'GRACE CUSTOMER', '', 119.00, 0.00, 0.00, 0.00, 119.00, NULL, NULL, '6', '', '', '', NULL, '', '', '', '', '', '', '', '2025-05-04'),
(117, 'GRC0117/2025-26', '1', 'all', '6', '4', '04-05-2025 13:22:07', 'A', 'GRACE CUSTOMER', '', 144.90, 0.00, 0.00, 0.00, 144.90, NULL, NULL, '5', '', '', '', NULL, '', '', '', '', '', '', '', '2025-05-04'),
(118, 'GRC0118/2025-26', '1', 'all', '10', '4', '04-05-2025 15:32:49', 'A', 'GRACE CUSTOMER', '', 232.00, 0.00, 0.00, 0.00, 232.00, NULL, NULL, '5', '', '', '', NULL, '', '', '', '', '', '', '', '2025-05-04'),
(119, 'GRC0119/2025-26', '1', 'all', '3', '4', '04-05-2025 15:33:55', 'A', 'GRACE CUSTOMER', '', 56.80, 0.00, 0.00, 0.00, 56.80, NULL, NULL, '5', '', '', '', NULL, '', '', '', '', '', '', '', '2025-05-04'),
(120, 'GRC0120/2025-26', '1', 'all', '13', '4', '05-05-2025 11:37:05', 'A', 'GRACE CUSTOMER', '', 335.80, 0.00, 0.00, 0.00, 335.80, NULL, NULL, '5', '', '', '', NULL, '', '', '', '', '', '', '', '2025-05-05'),
(121, 'GRC0121/2025-26', '1', 'all', '7', '4', '05-05-2025 11:38:39', 'A', 'GRACE CUSTOMER', '', 153.90, 0.00, 0.00, 0.00, 153.90, NULL, NULL, '5', '', '', '', NULL, '', '', '', '', '', '', '', '2025-05-05'),
(122, 'GRC0122/2025-26', '1', 'all', '2', '4', '05-05-2025 11:39:25', 'A', 'GRACE CUSTOMER', '', 31.80, 0.00, 0.00, 0.00, 31.80, NULL, NULL, '6', '', '', '', NULL, '', '', '', '', '', '', '', '2025-05-05'),
(123, 'GRC0123/2025-26', '1', 'all', '1', '4', '05-05-2025 11:41:26', 'A', 'GRACE CUSTOMER', '', 15.00, 0.00, 0.00, 0.00, 15.00, NULL, NULL, '5', '', '', '', NULL, '', '', '', '', '', '', '', '2025-05-05'),
(124, 'GRC0124/2025-26', 'all', '1', '147', '1', '05-05-2025 13:12:31', 'A', '', '', 2997.00, 0.00, 0.00, 0.00, 2997.00, NULL, NULL, '', '', '', '', NULL, '', '', '', '', '', '', '', '2025-05-05'),
(125, 'GRC0125/2025-26', '1', 'all', '6', '4', '05-05-2025 13:57:01', 'A', 'GRACE CUSTOMER', '', 124.00, 0.00, 0.00, 0.00, 124.00, NULL, NULL, '5', '', '', '', NULL, '', '', '', '', '', '', '', '2025-05-05'),
(126, 'GRC0126/2025-26', '1', 'all', '11', '4', '05-05-2025 16:06:51', 'A', 'GRACE CUSTOMER', '', 253.90, 0.00, 0.00, 0.00, 253.90, NULL, NULL, '6', '', '', '', NULL, '', '', '', '', '', '', '', '2025-05-05'),
(127, 'GRC0127/2025-26', '1', 'all', '8', '4', '05-05-2025 16:09:23', 'A', 'GRACE CUSTOMER', '', 190.80, 0.00, 0.00, 0.00, 190.80, NULL, NULL, '5', '', '', '', NULL, '', '', '', '', '', '', '', '2025-05-05'),
(128, 'GRC0128/2025-26', '1', 'all', '1', '4', '05-05-2025 16:31:55', 'A', 'GRACE CUSTOMER', '', 22.00, 0.00, 0.00, 0.00, 22.00, NULL, NULL, '5', '', '', '', NULL, '', '', '', '', '', '', '', '2025-05-05'),
(129, 'GRC0129/2025-26', '1', 'all', '3', '4', '06-05-2025 08:06:25', 'A', 'GRACE CUSTOMER', '', 70.00, 0.00, 0.00, 0.00, 70.00, NULL, NULL, '5', '', '', '', NULL, '', '', '', '', '', '', '', '2025-05-06'),
(130, 'GRC0130/2025-26', '1', 'all', '1', '4', '06-05-2025 08:07:26', 'A', 'GRACE CUSTOMER', '12345', 39.90, 0.00, 0.00, 0.00, 39.90, NULL, NULL, '5', '', '', '', NULL, '', '', '', '', '', '', '', '2025-05-06'),
(131, 'GRC0131/2025-26', '1', 'all', '8', '4', '06-05-2025 13:00:36', 'A', 'GRACE CUSTOMER', '', 154.90, 0.00, 0.00, 0.00, 154.90, NULL, NULL, '6', '', '', '', NULL, '', '', '', '', '', '', '', '2025-05-06'),
(132, 'GRC0132/2025-26', '1', 'all', '10', '4', '06-05-2025 13:02:09', 'A', 'GRACE CUSTOMER', '', 195.00, 0.00, 0.00, 0.00, 195.00, NULL, NULL, '5', '', '', '', NULL, '', '', '', '', '', '', '', '2025-05-06'),
(133, 'GRC0133/2025-26', '1', 'all', '7', '4', '06-05-2025 13:03:50', 'A', 'GRACE CUSTOMER', '', 142.00, 0.00, 0.00, 0.00, 142.00, NULL, NULL, '5', '', '', '', NULL, '', '', '', '', '', '', '', '2025-05-06'),
(134, 'GRC0134/2025-26', '1', 'all', '6', '4', '07-05-2025 07:53:13', 'A', 'GRACE CUSTOMER', '', 138.90, 0.00, 0.00, 0.00, 138.90, NULL, NULL, '5', '', '', '', NULL, '', '', '', '', '', '', '', '2025-05-07'),
(135, 'GRC0135/2025-26', '1', 'all', '9', '4', '07-05-2025 07:55:51', 'A', 'GRACE CUSTOMER', '', 181.90, 0.00, 0.00, 0.00, 181.90, NULL, NULL, '6', '', '', '', NULL, '', '', '', '', '', '', '', '2025-05-07'),
(136, 'GRC0136/2025-26', '1', 'all', '7', '4', '07-05-2025 07:57:52', 'A', 'GRACE CUSTOMER', '', 133.00, 0.00, 0.00, 0.00, 133.00, NULL, NULL, '5', '', '', '', NULL, '', '', '', '', '', '', '', '2025-05-07'),
(137, 'GRC0137/2025-26', '1', 'all', '3', '4', '07-05-2025 07:59:23', 'A', 'GRACE CUSTOMER', '', 66.00, 0.00, 0.00, 0.00, 66.00, NULL, NULL, '7', '', '', '', NULL, '', '', '', '', '', '', '', '2025-05-07'),
(138, 'GRC0138/2025-26', '1', 'all', '16', '4', '07-05-2025 16:50:54', 'A', 'GRACE CUSTOMER', '', 339.70, 0.00, 0.00, 0.00, 339.70, NULL, NULL, '5', '', '', '', NULL, '', '', '', '', '', '', '', '2025-05-07'),
(139, 'GRC0139/2025-26', '1', 'all', '4', '4', '07-05-2025 16:51:50', 'A', 'GRACE CUSTOMER', '', 108.80, 0.00, 0.00, 0.00, 108.80, NULL, NULL, '7', '', '', '', NULL, '', '', '', '', '', '', '', '2025-05-07'),
(140, 'GRC0140/2025-26', '1', 'all', '7', '4', '08-05-2025 15:53:35', 'A', 'GRACE CUSTOMER', '', 149.00, 0.00, 0.00, 0.00, 149.00, NULL, NULL, '5', '', '', '', NULL, '', '', '', '', '', '', '', '2025-05-08'),
(141, 'GRC0141/2025-26', '1', 'all', '10', '4', '08-05-2025 15:55:59', 'A', 'GRACE CUSTOMER', '', 304.60, 0.00, 0.00, 0.00, 304.60, NULL, NULL, '7', '', '', '', NULL, '', '', '', '', '', '', '', '2025-05-08'),
(142, 'GRC0142/2025-26', '1', 'all', '9', '4', '08-05-2025 17:51:21', 'A', 'GRACE CUSTOMER', '', 193.80, 0.00, 0.00, 0.00, 193.80, NULL, NULL, '5', '', '', '', NULL, '', '', '', '', '', '', '', '2025-05-08'),
(143, 'GRC0143/2025-26', '1', 'all', '6', '4', '08-05-2025 17:52:31', 'A', 'GRACE CUSTOMER', '', 107.00, 0.00, 0.00, 0.00, 107.00, NULL, NULL, '5', '', '', '', NULL, '', '', '', '', '', '', '', '2025-05-08'),
(144, 'GRC0144/2025-26', '1', 'all', '5', '4', '09-05-2025 07:41:56', 'A', 'GRACE CUSTOMER', '', 103.00, 0.00, 0.00, 0.00, 103.00, NULL, NULL, '5', '', '', '', NULL, '', '', '', '', '', '', '', '2025-05-09'),
(145, 'GRC0145/2025-26', '1', 'all', '1', '4', '09-05-2025 08:07:33', 'A', 'GRACE CUSTOMER', '', 59.90, 0.00, 0.00, 0.00, 59.90, NULL, NULL, '6', '', '', '', NULL, '', '', '', '', '', '', '', '2025-05-09'),
(146, 'GRC0146/2025-26', '1', 'all', '6', '4', '09-05-2025 16:33:29', 'A', 'GRACE CUSTOMER', '', 118.00, 0.00, 0.00, 0.00, 118.00, NULL, NULL, '6', '', '', '', NULL, '', '', '', '', '', '', '', '2025-05-09'),
(147, 'GRC0147/2025-26', '1', 'all', '2', '4', '09-05-2025 16:35:02', 'A', 'GRACE CUSTOMER', '', 39.00, 0.00, 0.00, 0.00, 39.00, NULL, NULL, '6', '', '', '', NULL, '', '', '', '', '', '', '', '2025-05-09'),
(148, 'GRC0148/2025-26', '1', 'all', '9', '4', '09-05-2025 16:36:44', 'A', 'GRACE CUSTOMER', '', 263.90, 0.00, 0.00, 0.00, 263.90, NULL, NULL, '7', '', '', '', NULL, '', '', '', '', '', '', '', '2025-05-09'),
(149, 'GRC0149/2025-26', '1', 'all', '18', '4', '09-05-2025 16:39:08', 'A', 'GRACE CUSTOMER', '', 428.70, 0.00, 0.00, 0.00, 428.70, NULL, NULL, '7', '', '', '', NULL, '', '', '', '', '', '', '', '2025-05-09'),
(150, 'GRC0150/2025-26', 'all', '1', '147', '1', '11-05-2025 09:35:02', 'A', '', '', 5102.80, 0.00, 0.00, 0.00, 5102.80, NULL, NULL, '', '', '', '', NULL, '', '', '', '', '', '', '', '2025-05-11'),
(151, 'GRC0151/2025-26', '1', 'all', '6', '4', '11-05-2025 09:38:35', 'A', 'GRACE CUSTOMER', '', 122.00, 0.00, 0.00, 0.00, 122.00, NULL, NULL, '7', '', '', '', NULL, '', '', '', '', '', '', '', '2025-05-11'),
(152, 'GRC0152/2025-26', '1', 'all', '6', '4', '11-05-2025 09:40:52', 'A', 'GRACE CUSTOMER', '', 143.90, 0.00, 0.00, 0.00, 143.90, NULL, NULL, '7', '', '', '', NULL, '', '', '', '', '', '', '', '2025-05-11'),
(153, 'GRC0153/2025-26', '1', 'all', '13', '4', '11-05-2025 09:45:11', 'A', 'GRACE CUSTOMER', '', 288.70, 0.00, 0.00, 0.00, 288.70, NULL, NULL, '6', '', '', '', NULL, '', '', '', '', '', '', '', '2025-05-11'),
(154, 'GRC0154/2025-26', '1', 'all', '7', '4', '11-05-2025 09:47:00', 'A', 'GRACE CUSTOMER', '', 209.50, 0.00, 0.00, 0.00, 209.50, NULL, NULL, '7', '', '', '', NULL, '', '', '', '', '', '', '', '2025-05-11'),
(155, 'GRC0155/2025-26', '1', 'all', '7', '4', '11-05-2025 09:48:43', 'A', 'GRACE CUSTOMER', '', 186.90, 0.00, 0.00, 0.00, 186.90, NULL, NULL, '5', '', '', '', NULL, '', '', '', '', '', '', '', '2025-05-11'),
(156, 'GRC0156/2025-26', '1', 'all', '13', '4', '11-05-2025 09:53:53', 'A', 'GRACE CUSTOMER', '', 299.90, 0.00, 0.00, 0.00, 299.90, NULL, NULL, '7', '', '', '', NULL, '', '', '', '', '', '', '', '2025-05-11'),
(157, 'GRC0157/2025-26', '1', 'all', '4', '4', '11-05-2025 09:54:49', 'A', 'GRACE CUSTOMER', '', 92.00, 0.00, 0.00, 0.00, 92.00, NULL, NULL, '7', '', '', '', NULL, '', '', '', '', '', '', '', '2025-05-11'),
(158, 'GRC0158/2025-26', '1', 'all', '6', '4', '11-05-2025 09:56:10', 'A', 'GRACE CUSTOMER', '', 130.90, 0.00, 0.00, 0.00, 130.90, NULL, NULL, '7', '', '', '', NULL, '', '', '', '', '', '', '', '2025-05-11'),
(159, 'GRC0159/2025-26', '1', 'all', '9', '4', '11-05-2025 09:58:33', 'A', 'GRACE CUSTOMER', '', 251.80, 0.00, 0.00, 0.00, 251.80, NULL, NULL, '7', '', '', '', NULL, '', '', '', '', '', '', '', '2025-05-11'),
(160, 'GRC0160/2025-26', '1', 'all', '8', '4', '11-05-2025 10:05:05', 'A', 'GRACE CUSTOMER', '', 149.00, 0.00, 0.00, 0.00, 149.00, NULL, NULL, '7', '', '', '', NULL, '', '', '', '', '', '', '', '2025-05-11'),
(161, 'GRC0161/2025-26', '1', 'all', '16', '4', '11-05-2025 10:13:20', 'A', 'GRACE CUSTOMER', '', 383.70, 0.00, 0.00, 0.00, 383.70, NULL, NULL, '7', '', '', '', NULL, '', '', '', '', '', '', '', '2025-05-11'),
(162, 'GRC0162/2025-26', '1', 'all', '8', '4', '11-05-2025 10:18:30', 'A', 'GRACE CUSTOMER', '', 181.00, 0.00, 0.00, 0.00, 181.00, NULL, NULL, '7', '', '', '', NULL, '', '', '', '', '', '', '', '2025-05-11'),
(163, 'GRC0163/2025-26', '1', 'all', '7', '4', '11-05-2025 10:22:09', 'A', 'GRACE CUSTOMER', '', 150.00, 0.00, 0.00, 0.00, 150.00, NULL, NULL, '7', '', '', '', NULL, '', '', '', '', '', '', '', '2025-05-11'),
(164, 'GRC0164/2025-26', '1', 'all', '8', '4', '11-05-2025 10:25:51', 'A', 'GRACE CUSTOMER', '', 169.90, 0.00, 0.00, 0.00, 169.90, NULL, NULL, '7', '', '', '', NULL, '', '', '', '', '', '', '', '2025-05-11'),
(165, 'GRC0165/2025-26', '1', 'all', '1', '4', '11-05-2025 10:45:33', 'A', 'GRACE CUSTOMER', '', 33.90, 0.00, 0.00, 0.00, 33.90, NULL, NULL, '7', '', '', '', NULL, '', '', '', '', '', '', '', '2025-05-11'),
(166, 'GRC0166/2025-26', '1', 'all', '4', '4', '11-05-2025 10:47:35', 'A', 'GRACE CUSTOMER', '', 91.00, 0.00, 0.00, 0.00, 91.00, NULL, NULL, '7', '', '', '', NULL, '', '', '', '', '', '', '', '2025-05-11'),
(167, 'GRC0167/2025-26', '1', 'all', '4', '4', '13-05-2025 08:23:06', 'A', 'GRACE CUSTOMER', '', 99.90, 0.00, 0.00, 0.00, 99.90, NULL, NULL, '7', '', '', '', NULL, '', '', '', '', '', '', '', '2025-05-13'),
(168, 'GRC0168/2025-26', '1', 'all', '9', '4', '13-05-2025 08:24:46', 'A', 'GRACE CUSTOMER', '', 215.70, 0.00, 0.00, 0.00, 215.70, NULL, NULL, '6', '', '', '', NULL, '', '', '', '', '', '', '', '2025-05-13'),
(169, 'GRC0169/2025-26', '1', 'all', '6', '4', '13-05-2025 08:25:57', 'A', 'GRACE CUSTOMER', '', 174.90, 0.00, 0.00, 0.00, 174.90, NULL, NULL, '7', '', '', '', NULL, '', '', '', '', '', '', '', '2025-05-13'),
(170, 'GRC0170/2025-26', '1', 'all', '8', '4', '13-05-2025 08:27:29', 'A', 'GRACE CUSTOMER', '', 170.90, 0.00, 0.00, 0.00, 170.90, NULL, NULL, '7', '', '', '', NULL, '', '', '', '', '', '', '', '2025-05-13'),
(171, 'GRC0171/2025-26', '1', 'all', '13', '4', '13-05-2025 08:29:33', 'A', 'GRACE CUSTOMER', '', 263.90, 0.00, 0.00, 0.00, 263.90, NULL, NULL, '6', '', '', '', NULL, '', '', '', '', '', '', '', '2025-05-13'),
(172, 'GRC0172/2025-26', '1', 'all', '9', '4', '13-05-2025 08:31:16', 'A', 'GRACE CUSTOMER', '', 174.90, 0.00, 0.00, 0.00, 174.90, NULL, NULL, '7', '', '', '', NULL, '', '', '', '', '', '', '', '2025-05-13'),
(173, 'GRC0173/2025-26', '1', 'all', '11', '4', '13-05-2025 08:33:14', 'A', 'GRACE CUSTOMER', '', 268.90, 0.00, 0.00, 0.00, 268.90, NULL, NULL, '5', '', '', '', NULL, '', '', '', '', '', '', '', '2025-05-13'),
(174, 'GRC0174/2025-26', '1', 'all', '8', '4', '13-05-2025 08:34:38', 'A', 'GRACE CUSTOMER', '', 273.70, 0.00, 0.00, 0.00, 273.70, NULL, NULL, '7', '', '', '', NULL, '', '', '', '', '', '', '', '2025-05-13'),
(175, 'GRC0175/2025-26', '1', 'all', '2', '4', '13-05-2025 08:36:06', 'A', 'GRACE CUSTOMER', '', 40.00, 0.00, 0.00, 0.00, 40.00, NULL, NULL, '7', '', '', '', NULL, '', '', '', '', '', '', '', '2025-05-13'),
(176, 'GRC0176/2025-26', '1', 'all', '2', '4', '13-05-2025 08:36:08', 'A', 'GRACE CUSTOMER', '', 40.00, 0.00, 0.00, 0.00, 40.00, NULL, NULL, '7', '', '', '', NULL, '', '', '', '', '', '', '', '2025-05-13'),
(177, 'GRC0177/2025-26', '1', 'all', '9', '4', '13-05-2025 08:38:04', 'A', 'GRACE CUSTOMER', '', 229.80, 0.00, 0.00, 0.00, 229.80, NULL, NULL, '6', '', '', '', NULL, '', '', '', '', '', '', '', '2025-05-13'),
(178, 'GRC0178/2025-26', '1', 'all', '9', '4', '13-05-2025 09:41:09', 'A', 'GRACE CUSTOMER', '', 158.80, 0.00, 0.00, 0.00, 158.80, NULL, NULL, '7', '', '', '', NULL, '', '', '', '', '', '', '', '2025-05-13'),
(179, 'GRC0179/2025-26', 'all', '1', '60', '1', '13-05-2025 11:59:24', 'A', '', '', 1200.00, 0.00, 0.00, 0.00, 1200.00, NULL, NULL, '', '', '', '', NULL, '', '', '', '', '', '', '', '2025-05-13'),
(180, 'GRC0180/2025-26', '1', 'all', '3', '4', '13-05-2025 14:49:34', 'A', 'GRACE CUSTOMER', '', 54.00, 0.00, 0.00, 0.00, 54.00, NULL, NULL, '7', '', '', '', NULL, '', '', '', '', '', '', '', '2025-05-13'),
(181, 'GRC0181/2025-26', '1', 'all', '7', '4', '13-05-2025 14:53:02', 'A', 'GRACE CUSTOMER', '', 181.80, 0.00, 0.00, 0.00, 181.80, NULL, NULL, '6', '', '', '', NULL, '', '', '', '', '', '', '', '2025-05-13'),
(182, 'GRC0182/2025-26', '1', 'all', '1', '4', '13-05-2025 14:54:27', 'A', 'GRACE CUSTOMER', '', 22.00, 0.00, 0.00, 0.00, 22.00, NULL, NULL, '7', '', '', '', NULL, '', '', '', '', '', '', '', '2025-05-13'),
(183, 'GRC0183/2025-26', '1', 'all', '1', '4', '13-05-2025 14:54:58', 'A', 'GRACE CUSTOMER', '', 15.00, 0.00, 0.00, 0.00, 15.00, NULL, NULL, '5', '', '', '', NULL, '', '', '', '', '', '', '', '2025-05-13'),
(184, 'GRC0184/2025-26', '1', 'all', '8', '4', '13-05-2025 14:59:36', 'A', 'GRACE CUSTOMER', '', 191.90, 0.00, 0.00, 0.00, 191.90, NULL, NULL, '6', '', '', '', NULL, '', '', '', '', '', '', '', '2025-05-13'),
(185, 'GRC0185/2025-26', '1', 'all', '9', '4', '13-05-2025 15:02:02', 'A', 'GRACE CUSTOMER', '', 192.90, 0.00, 0.00, 0.00, 192.90, NULL, NULL, '6', '', '', '', NULL, '', '', '', '', '', '', '', '2025-05-13'),
(186, 'GRC0186/2025-26', '1', 'all', '7', '4', '13-05-2025 15:03:26', 'A', 'GRACE CUSTOMER', '', 148.90, 0.00, 0.00, 0.00, 148.90, NULL, NULL, '5', '', '', '', NULL, '', '', '', '', '', '', '', '2025-05-13'),
(187, 'GRC0187/2025-26', '1', 'all', '4', '4', '13-05-2025 15:05:24', 'A', 'GRACE CUSTOMER', '', 102.00, 0.00, 0.00, 0.00, 102.00, NULL, NULL, '6', '', '', '', NULL, '', '', '', '', '', '', '', '2025-05-13'),
(188, 'GRC0188/2025-26', '1', 'all', '7', '4', '13-05-2025 15:07:40', 'A', 'GRACE CUSTOMER', '', 155.80, 0.00, 0.00, 0.00, 155.80, NULL, NULL, '6', '', '', '', NULL, '', '', '', '', '', '', '', '2025-05-13'),
(189, 'GRC0189/2025-26', '1', 'all', '9', '4', '13-05-2025 15:09:06', 'A', 'GRACE CUSTOMER', '', 186.00, 0.00, 0.00, 0.00, 186.00, NULL, NULL, '6', '', '', '', NULL, '', '', '', '', '', '', '', '2025-05-13'),
(190, 'GRC0190/2025-26', '1', 'all', '8', '4', '15-05-2025 08:09:18', 'A', 'GRACE CUSTOMER', '', 154.00, 0.00, 0.00, 0.00, 154.00, NULL, NULL, '7', '', '', '', NULL, '', '', '', '', '', '', '', '2025-05-15'),
(191, 'GRC0191/2025-26', '1', 'all', '3', '4', '15-05-2025 08:12:10', 'A', 'GRACE CUSTOMER', '', 61.90, 0.00, 0.00, 0.00, 61.90, NULL, NULL, '5', '', '', '', NULL, '', '', '', '', '', '', '', '2025-05-15'),
(192, 'GRC0192/2025-26', '1', 'all', '3', '4', '15-05-2025 08:13:18', 'A', 'GRACE CUSTOMER', '', 114.90, 0.00, 0.00, 0.00, 114.90, NULL, NULL, '5', '', '', '', NULL, '', '', '', '', '', '', '', '2025-05-15'),
(193, 'GRC0193/2025-26', '1', 'all', '2', '4', '15-05-2025 08:19:04', 'A', 'GRACE CUSTOMER', '', 40.00, 0.00, 0.00, 0.00, 40.00, NULL, NULL, '5', '', '', '', NULL, '', '', '', '', '', '', '', '2025-05-15'),
(194, 'GRC0194/2025-26', '1', 'all', '7', '4', '15-05-2025 08:20:30', 'A', 'GRACE CUSTOMER', '', 137.00, 0.00, 0.00, 0.00, 137.00, NULL, NULL, '5', '', '', '', NULL, '', '', '', '', '', '', '', '2025-05-15'),
(195, 'GRC0195/2025-26', '1', 'all', '13', '4', '15-05-2025 08:22:11', 'A', 'GRACE CUSTOMER', '', 278.90, 0.00, 0.00, 0.00, 278.90, NULL, NULL, '6', '', '', '', NULL, '', '', '', '', '', '', '', '2025-05-15'),
(196, 'GRC0196/2025-26', '1', 'all', '12', '4', '15-05-2025 08:25:54', 'A', 'GRACE CUSTOMER', '', 297.70, 0.00, 0.00, 0.00, 297.70, NULL, NULL, '6', '', '', '', NULL, '', '', '', '', '', '', '', '2025-05-15'),
(197, 'GRC0197/2025-26', '1', 'all', '1', '4', '15-05-2025 08:28:03', 'A', 'GRACE CUSTOMER', '', 59.90, 0.00, 0.00, 0.00, 59.90, NULL, NULL, '5', '', '', '', NULL, '', '', '', '', '', '', '', '2025-05-15'),
(198, 'GRC0198/2025-26', '1', 'all', '1', '4', '15-05-2025 09:59:35', 'A', 'GRACE CUSTOMER', '', 64.90, 0.00, 0.00, 0.00, 64.90, NULL, NULL, '5', '', '', '', NULL, '', '', '', '', '', '', '', '2025-05-15'),
(199, 'GRC0199/2025-26', '1', 'all', '4', '4', '15-05-2025 11:50:38', 'A', 'GRACE CUSTOMER', '', 209.60, 0.00, 0.00, 0.00, 209.60, NULL, NULL, '5', '', '', '', NULL, '', '', '', '', '', '', '', '2025-05-15'),
(200, 'GRC0200/2025-26', '1', 'all', '1', '4', '15-05-2025 12:47:23', 'A', 'GRACE CUSTOMER', '', 17.00, 0.00, 0.00, 0.00, 17.00, NULL, NULL, '5', '', '', '', NULL, '', '', '', '', '', '', '', '2025-05-15'),
(201, 'GRC0201/2025-26', '1', 'all', '8', '4', '15-05-2025 15:40:03', 'A', 'GRACE CUSTOMER', '', 198.70, 0.00, 0.00, 0.00, 198.70, NULL, NULL, '5', '', '', '', NULL, '', '', '', '', '', '', '', '2025-05-15'),
(202, 'GRC0202/2025-26', '1', 'all', '1', '4', '15-05-2025 15:40:45', 'A', 'GRACE CUSTOMER', '', 39.00, 0.00, 0.00, 0.00, 39.00, NULL, NULL, '5', '', '', '', NULL, '', '', '', '', '', '', '', '2025-05-15'),
(203, 'GRC0203/2025-26', '1', 'all', '8', '4', '16-05-2025 08:47:52', 'A', 'GRACE CUSTOMER', '', 288.60, 0.00, 0.00, 0.00, 288.60, NULL, NULL, '6', '', '', '', NULL, '', '', '', '', '', '', '', '2025-05-16'),
(204, 'GRC0204/2025-26', '1', 'all', '9', '4', '16-05-2025 08:49:36', 'A', 'GRACE CUSTOMER', '', 262.80, 0.00, 0.00, 0.00, 262.80, NULL, NULL, '5', '', '', '', NULL, '', '', '', '', '', '', '', '2025-05-16'),
(205, 'GRC0205/2025-26', '1', 'all', '3', '4', '16-05-2025 08:52:20', 'A', 'GRACE CUSTOMER', '', 55.00, 0.00, 0.00, 0.00, 55.00, NULL, NULL, '7', '', '', '', NULL, '', '', '', '', '', '', '', '2025-05-16'),
(206, 'GRC0206/2025-26', '1', 'all', '2', '4', '16-05-2025 09:16:17', 'A', 'GRACE CUSTOMER', '', 53.90, 0.00, 0.00, 0.00, 53.90, NULL, NULL, '5', '', '', '', NULL, '', '', '', '', '', '', '', '2025-05-16'),
(207, 'GRC0207/2025-26', '1', 'all', '14', '4', '16-05-2025 12:52:58', 'A', 'GRACE CUSTOMER', '', 355.80, 0.00, 0.00, 0.00, 355.80, NULL, NULL, '7', '', '', '', NULL, '', '', '', '', '', '', '', '2025-05-16'),
(208, 'GRC0208/2025-26', '1', 'all', '4', '4', '16-05-2025 14:35:55', 'A', 'GRACE CUSTOMER', '', 127.80, 0.00, 0.00, 0.00, 127.80, NULL, NULL, '5', '', '', '', NULL, '', '', '', '', '', '', '', '2025-05-16'),
(209, 'GRC0209/2025-26', '1', 'all', '5', '4', '16-05-2025 14:36:42', 'A', 'GRACE CUSTOMER', '', 111.90, 0.00, 0.00, 0.00, 111.90, NULL, NULL, '6', '', '', '', NULL, '', '', '', '', '', '', '', '2025-05-16'),
(210, 'GRC0210/2025-26', '1', 'all', '4', '4', '16-05-2025 14:37:55', 'A', 'GRACE CUSTOMER', '', 84.00, 0.00, 0.00, 0.00, 84.00, NULL, NULL, '6', '', '', '', NULL, '', '', '', '', '', '', '', '2025-05-16'),
(211, 'GRC0211/2025-26', '1', 'all', '8', '4', '16-05-2025 15:32:42', 'A', 'GRACE CUSTOMER', '', 259.80, 0.00, 0.00, 0.00, 259.80, NULL, NULL, '5', '', '', '', NULL, '', '', '', '', '', '', '', '2025-05-16'),
(212, 'GRC0212/2025-26', '1', 'all', '4', '4', '17-05-2025 07:45:37', 'A', 'GRACE CUSTOMER', '', 85.00, 0.00, 0.00, 0.00, 85.00, NULL, NULL, '5', '', '', '', NULL, '', '', '', '', '', '', '', '2025-05-17'),
(213, 'GRC0213/2025-26', '1', 'all', '7', '4', '17-05-2025 07:46:53', 'A', 'GRACE CUSTOMER', '', 166.00, 0.00, 0.00, 0.00, 166.00, NULL, NULL, '6', '', '', '', NULL, '', '', '', '', '', '', '', '2025-05-17'),
(214, 'GRC0214/2025-26', '1', 'all', '7', '4', '17-05-2025 07:48:08', 'A', 'GRACE CUSTOMER', '', 175.80, 0.00, 0.00, 0.00, 175.80, NULL, NULL, '6', '', '', '', NULL, '', '', '', '', '', '', '', '2025-05-17'),
(215, 'GRC0215/2025-26', '1', 'all', '7', '4', '17-05-2025 08:03:28', 'A', 'GRACE CUSTOMER', '', 198.80, 0.00, 0.00, 0.00, 198.80, NULL, NULL, '5', '', '', '', NULL, '', '', '', '', '', '', '', '2025-05-17'),
(216, 'GRC0216/2025-26', '1', 'all', '9', '4', '17-05-2025 14:17:02', 'A', 'GRACE CUSTOMER', '', 220.00, 0.00, 0.00, 0.00, 220.00, NULL, NULL, '6', '', '', '', NULL, '', '', '', '', '', '', '', '2025-05-17'),
(217, 'GRC0217/2025-26', '1', 'all', '8', '4', '17-05-2025 14:20:19', 'A', 'GRACE CUSTOMER', '', 226.00, 0.00, 0.00, 0.00, 226.00, NULL, NULL, '5', '', '', '', NULL, '', '', '', '', '', '', '', '2025-05-17'),
(218, 'GRC0218/2025-26', '1', 'all', '4', '4', '17-05-2025 14:29:18', 'A', 'GRACE CUSTOMER', '', 114.90, 0.00, 0.00, 0.00, 114.90, NULL, NULL, '5', '', '', '', NULL, '', '', '', '', '', '', '', '2025-05-17'),
(219, 'GRC0219/2025-26', '1', 'all', '1', '4', '17-05-2025 14:30:45', 'A', 'GRACE CUSTOMER', '', 20.00, 0.00, 0.00, 0.00, 20.00, NULL, NULL, '5', '', '', '', NULL, '', '', '', '', '', '', '', '2025-05-17'),
(220, 'GRC0220/2025-26', 'all', '1', '176', '1', '17-05-2025 14:52:34', 'A', 'GRACE CUSTOMER', '', 3412.00, 0.00, 0.00, 0.00, 3412.00, NULL, NULL, '', '', '', '', NULL, '', '', '', '', '', '', '', '2025-05-17'),
(221, 'GRC0221/2025-26', '1', 'all', '1', '4', '17-05-2025 14:57:04', 'A', 'GRACE CUSTOMER', '', 19.00, 0.00, 0.00, 0.00, 19.00, NULL, NULL, '7', '', '', '', NULL, '', '', '', '', '', '', '', '2025-05-17'),
(222, 'GRC0222/2025-26', '1', 'all', '1', '4', '17-05-2025 14:59:10', 'A', 'GRACE CUSTOMER', '', 19.00, 0.00, 0.00, 0.00, 19.00, NULL, NULL, '7', '', '', '', NULL, '', '', '', '', '', '', '', '2025-05-17'),
(223, 'GRC0223/2025-26', '1', 'all', '2', '4', '17-05-2025 15:37:33', 'A', 'GRACE CUSTOMER', '', 50.00, 0.00, 0.00, 0.00, 50.00, NULL, NULL, '6', '', '', '', NULL, '', '', '', '', '', '', '', '2025-05-17'),
(224, 'GRC0224/2025-26', '1', 'all', '3', '4', '17-05-2025 15:52:25', 'A', 'GRACE CUSTOMER', '', 83.90, 0.00, 0.00, 0.00, 83.90, NULL, NULL, '5', '', '', '', NULL, '', '', '', '', '', '', '', '2025-05-17'),
(225, 'GRC0225/2025-26', '1', 'all', '4', '4', '17-05-2025 16:00:00', 'A', 'GRACE CUSTOMER', '', 110.90, 0.00, 0.00, 0.00, 110.90, NULL, NULL, '5', '', '', '', NULL, '', '', '', '', '', '', '', '2025-05-17'),
(226, 'GRC0226/2025-26', '1', 'all', '5', '4', '18-05-2025 08:00:10', 'A', 'GRACE CUSTOMER', '', 103.00, 0.00, 0.00, 0.00, 103.00, NULL, NULL, '6', '', '', '', NULL, '', '', '', '', '', '', '', '2025-05-18'),
(227, 'GRC0227/2025-26', '1', 'all', '8', '4', '18-05-2025 08:11:29', 'A', 'GRACE CUSTOMER', '', 231.50, 0.00, 0.00, 0.00, 231.50, NULL, NULL, '5', '', '', '', NULL, '', '', '', '', '', '', '', '2025-05-18'),
(228, 'GRC0228/2025-26', '1', 'all', '8', '4', '18-05-2025 08:13:31', 'A', 'GRACE CUSTOMER', '', 178.90, 0.00, 0.00, 0.00, 178.90, NULL, NULL, '5', '', '', '', NULL, '', '', '', '', '', '', '', '2025-05-18'),
(229, 'GRC0229/2025-26', '1', 'all', '2', '4', '18-05-2025 08:15:09', 'A', 'GRACE CUSTOMER', '', 49.00, 0.00, 0.00, 0.00, 49.00, NULL, NULL, '7', '', '', '', NULL, '', '', '', '', '', '', '', '2025-05-18'),
(230, 'GRC0230/2025-26', '1', 'all', '11', '4', '18-05-2025 08:18:20', 'A', 'GRACE CUSTOMER', '', 284.80, 0.00, 0.00, 0.00, 284.80, NULL, NULL, '5', '', '', '', NULL, '', '', '', '', '', '', '', '2025-05-18'),
(231, 'GRC0231/2025-26', '1', 'all', '2', '4', '18-05-2025 08:19:40', 'A', 'GRACE CUSTOMER', '', 66.90, 0.00, 0.00, 0.00, 66.90, NULL, NULL, '5', '', '', '', NULL, '', '', '', '', '', '', '', '2025-05-18'),
(232, 'GRC0232/2025-26', '1', 'all', '1', '4', '18-05-2025 08:20:50', 'A', 'GRACE CUSTOMER', '', 21.00, 0.00, 0.00, 0.00, 21.00, NULL, NULL, '6', '', '', '', NULL, '', '', '', '', '', '', '', '2025-05-18'),
(233, 'GRC0233/2025-26', '1', 'all', '1', '4', '18-05-2025 08:21:53', 'A', 'GRACE CUSTOMER', '', 33.90, 0.00, 0.00, 0.00, 33.90, NULL, NULL, '6', '', '', '', NULL, '', '', '', '', '', '', '', '2025-05-18'),
(234, 'GRC0234/2025-26', '1', 'all', '12', '4', '18-05-2025 11:46:40', 'A', 'GRACE CUSTOMER', '', 286.90, 0.00, 0.00, 0.00, 286.90, NULL, NULL, '5', '', '', '', NULL, '', '', '', '', '', '', '', '2025-05-18'),
(235, 'GRC0235/2025-26', '1', 'all', '17', '4', '18-05-2025 12:15:24', 'A', 'GRACE CUSTOMER', '', 294.90, 0.00, 0.00, 0.00, 294.90, NULL, NULL, '5', '', '', '', NULL, '', '', '', '', '', '', '', '2025-05-18'),
(236, 'GRC0236/2025-26', '1', 'all', '2', '4', '18-05-2025 12:24:59', 'A', 'GRACE CUSTOMER', '', 46.90, 0.00, 0.00, 0.00, 46.90, NULL, NULL, '5', '', '', '', NULL, '', '', '', '', '', '', '', '2025-05-18'),
(237, 'GRC0237/2025-26', '1', 'all', '11', '4', '18-05-2025 15:06:01', 'A', 'GRACE CUSTOMER', '', 263.80, 0.00, 0.00, 0.00, 263.80, NULL, NULL, '5', '', '', '', NULL, '', '', '', '', '', '', '', '2025-05-18'),
(238, 'GRC0238/2025-26', '1', 'all', '6', '4', '18-05-2025 15:07:06', 'A', 'GRACE CUSTOMER', '', 132.90, 0.00, 0.00, 0.00, 132.90, NULL, NULL, '6', '', '', '', NULL, '', '', '', '', '', '', '', '2025-05-18'),
(239, 'GRC0239/2025-26', '1', 'all', '6', '4', '19-05-2025 14:38:39', 'A', 'GRACE CUSTOMER', '', 132.90, 0.00, 0.00, 0.00, 132.90, NULL, NULL, '6', '', '', '', NULL, '', '', '', '', '', '', '', '2025-05-19'),
(240, 'GRC0240/2025-26', '1', 'all', '12', '4', '19-05-2025 14:42:18', 'A', 'GRACE CUSTOMER', '', 245.80, 0.00, 0.00, 0.00, 245.80, NULL, NULL, '5', '', '', '', NULL, '', '', '', '', '', '', '', '2025-05-19'),
(241, 'GRC0241/2025-26', '1', 'all', '5', '4', '19-05-2025 14:43:13', 'A', 'GRACE CUSTOMER', '', 101.90, 0.00, 0.00, 0.00, 101.90, NULL, NULL, '5', '', '', '', NULL, '', '', '', '', '', '', '', '2025-05-19');
INSERT INTO `stk_transaction` (`TRN_ID`, `TRN_CODE`, `WH_FROMID`, `WH_TOID`, `NO_ITEMS`, `CREATED_BY`, `CREATED_DATE`, `TRN_STATUS`, `CUSTOMER_NAME`, `CUSTOMER_MOBILE`, `SUB_TOTAL`, `TRN_TAX`, `DISCOUNT`, `SHIPPING`, `TOTAL_AMT`, `UPDATED_BY`, `UPDATED_DATE`, `SALES_PERSON`, `IE_CODE`, `LUT_CODE`, `AD_CODE`, `GOODS_ORIGIN`, `FINAL_DEST`, `MODE_PAYMENT`, `VESSEL`, `PORT_DIS`, `SHIP_AGENT`, `PORT_LOAD`, `DELI_ADDRESS`, `INVOICE_DATE`) VALUES
(242, 'GRC0242/2025-26', '1', 'all', '4', '4', '19-05-2025 14:44:21', 'A', 'GRACE CUSTOMER', '', 84.00, 0.00, 0.00, 0.00, 84.00, NULL, NULL, '7', '', '', '', NULL, '', '', '', '', '', '', '', '2025-05-19'),
(243, 'GRC0243/2025-26', '1', 'all', '7', '4', '19-05-2025 14:45:41', 'A', 'GRACE CUSTOMER', '', 188.70, 0.00, 0.00, 0.00, 188.70, NULL, NULL, '6', '', '', '', NULL, '', '', '', '', '', '', '', '2025-05-19'),
(244, 'GRC0244/2025-26', '1', 'all', '2', '4', '19-05-2025 14:46:21', 'A', 'GRACE CUSTOMER', '', 44.00, 0.00, 0.00, 0.00, 44.00, NULL, NULL, '5', '', '', '', NULL, '', '', '', '', '', '', '', '2025-05-19'),
(245, 'GRC0245/2025-26', '1', 'all', '3', '4', '19-05-2025 18:02:54', 'A', 'GRACE CUSTOMER', '', 58.00, 0.00, 0.00, 0.00, 58.00, NULL, NULL, '5', '', '', '', NULL, '', '', '', '', '', '', '', '2025-05-19'),
(246, 'GRC0246/2025-26', '1', 'all', '5', '4', '20-05-2025 12:44:52', 'A', 'GRACE CUSTOMER', '', 124.90, 0.00, 0.00, 0.00, 124.90, NULL, NULL, '6', '', '', '', NULL, '', '', '', '', '', '', '', '2025-05-20'),
(247, 'GRC0247/2025-26', '1', 'all', '9', '4', '20-05-2025 12:46:44', 'A', 'GRACE CUSTOMER', '', 189.00, 0.00, 0.00, 0.00, 189.00, NULL, NULL, '5', '', '', '', NULL, '', '', '', '', '', '', '', '2025-05-20'),
(248, 'GRC0248/2025-26', '1', 'all', '8', '4', '20-05-2025 12:48:25', 'A', 'GRACE CUSTOMER', '', 190.80, 0.00, 0.00, 0.00, 190.80, NULL, NULL, '7', '', '', '', NULL, '', '', '', '', '', '', '', '2025-05-20'),
(249, 'GRC0249/2025-26', '1', 'all', '4', '4', '20-05-2025 12:50:45', 'A', 'GRACE CUSTOMER', '', 94.90, 0.00, 0.00, 0.00, 94.90, NULL, NULL, '7', '', '', '', NULL, '', '', '', '', '', '', '', '2025-05-20'),
(250, 'GRC0250/2025-26', '1', 'all', '9', '4', '20-05-2025 12:52:13', 'A', 'GRACE CUSTOMER', '', 259.00, 0.00, 0.00, 0.00, 259.00, NULL, NULL, '7', '', '', '', NULL, '', '', '', '', '', '', '', '2025-05-20'),
(251, 'GRC0251/2025-26', '1', 'all', '18', '4', '20-05-2025 18:14:56', 'A', 'GRACE CUSTOMER', '', 451.50, 0.00, 0.00, 0.00, 451.50, NULL, NULL, '7', '', '', '', NULL, '', '', '', '', '', '', '', '2025-05-20'),
(252, 'GRC0252/2025-26', '1', 'all', '6', '4', '20-05-2025 18:15:57', 'A', 'GRACE CUSTOMER', '', 126.00, 0.00, 0.00, 0.00, 126.00, NULL, NULL, '6', '', '', '', NULL, '', '', '', '', '', '', '', '2025-05-20'),
(253, 'GRC0253/2025-26', '1', 'all', '12', '4', '21-05-2025 14:52:32', 'A', 'GRACE CUSTOMER', '', 321.70, 0.00, 0.00, 0.00, 321.70, NULL, NULL, '5', '', '', '', NULL, '', '', '', '', '', '', '', '2025-05-21'),
(254, 'GRC0254/2025-26', '1', 'all', '10', '4', '21-05-2025 14:54:50', 'A', 'GRACE CUSTOMER', '', 268.90, 0.00, 0.00, 0.00, 268.90, NULL, NULL, '7', '', '', '', NULL, '', '', '', '', '', '', '', '2025-05-21'),
(255, 'GRC0255/2025-26', '1', 'all', '7', '4', '21-05-2025 15:00:01', 'A', 'GRACE CUSTOMER', '', 172.00, 0.00, 0.00, 0.00, 172.00, NULL, NULL, '5', '', '', '', NULL, '', '', '', '', '', '', '', '2025-05-21'),
(256, 'GRC0256/2025-26', '1', 'all', '3', '4', '21-05-2025 16:32:13', 'A', 'GRACE CUSTOMER', '', 77.90, 0.00, 0.00, 0.00, 77.90, NULL, NULL, '5', '', '', '', NULL, '', '', '', '', '', '', '', '2025-05-21'),
(257, 'GRC0257/2025-26', '1', 'all', '4', '4', '21-05-2025 16:33:44', 'A', 'GRACE CUSTOMER', '', 161.80, 0.00, 0.00, 0.00, 161.80, NULL, NULL, '5', '', '', '', NULL, '', '', '', '', '', '', '', '2025-05-21'),
(258, 'GRC0258/2025-26', '1', 'all', '16', '4', '22-05-2025 09:05:46', 'A', 'GRACE CUSTOMER', '', 340.80, 0.00, 0.00, 0.00, 340.80, NULL, NULL, '5', '', '', '', NULL, '', '', '', '', '', '', '', '2025-05-22'),
(259, 'GRC0259/2025-26', '1', 'all', '1', '4', '22-05-2025 09:06:36', 'A', 'GRACE CUSTOMER', '', 14.00, 0.00, 0.00, 0.00, 14.00, NULL, NULL, '5', '', '', '', NULL, '', '', '', '', '', '', '', '2025-05-22'),
(260, 'GRC0260/2025-26', '1', 'all', '5', '4', '22-05-2025 09:07:55', 'A', 'GRACE CUSTOMER', '', 145.80, 0.00, 0.00, 0.00, 145.80, NULL, NULL, '5', '', '', '', NULL, '', '', '', '', '', '', '', '2025-05-22'),
(261, 'GRC0261/2025-26', '1', 'all', '8', '4', '22-05-2025 13:50:16', 'A', 'GRACE CUSTOMER', '', 164.00, 0.00, 0.00, 0.00, 164.00, NULL, NULL, '5', '', '', '', NULL, '', '', '', '', '', '', '', '2025-05-22'),
(262, 'GRC0262/2025-26', '1', 'all', '8', '4', '22-05-2025 13:53:53', 'A', 'GRACE CUSTOMER', '', 168.00, 0.00, 0.00, 0.00, 168.00, NULL, NULL, '5', '', '', '', NULL, '', '', '', '', '', '', '', '2025-05-22'),
(263, 'GRC0263/2025-26', '1', 'all', '1', '4', '22-05-2025 13:54:36', 'A', 'GRACE CUSTOMER', '', 20.00, 0.00, 0.00, 0.00, 20.00, NULL, NULL, '5', '', '', '', NULL, '', '', '', '', '', '', '', '2025-05-22'),
(264, 'GRC0264/2025-26', '1', 'all', '2', '4', '22-05-2025 13:56:39', 'A', 'GRACE CUSTOMER', '', 38.00, 0.00, 0.00, 0.00, 38.00, NULL, NULL, '5', '', '', '', NULL, '', '', '', '', '', '', '', '2025-05-22'),
(265, 'GRC0265/2025-26', '1', 'all', '5', '4', '22-05-2025 13:58:27', 'A', 'GRACE CUSTOMER', '', 84.00, 0.00, 0.00, 0.00, 84.00, NULL, NULL, '5', '', '', '', NULL, '', '', '', '', '', '', '', '2025-05-22'),
(266, 'GRC0266/2025-26', '1', 'all', '7', '4', '22-05-2025 14:01:15', 'A', 'GRACE CUSTOMER', '', 199.70, 0.00, 0.00, 0.00, 199.70, NULL, NULL, '5', '', '', '', NULL, '', '', '', '', '', '', '', '2025-05-22'),
(267, 'GRC0267/2025-26', '1', 'all', '9', '4', '22-05-2025 18:02:28', 'A', 'GRACE CUSTOMER', '', 184.00, 0.00, 0.00, 0.00, 184.00, NULL, NULL, '5', '', '', '', NULL, '', '', '', '', '', '', '', '2025-05-22'),
(268, 'GRC0268/2025-26', '1', 'all', '5', '4', '22-05-2025 18:06:29', 'A', 'GRACE CUSTOMER', '', 107.80, 0.00, 0.00, 0.00, 107.80, NULL, NULL, '5', '', '', '', NULL, '', '', '', '', '', '', '', '2025-05-22'),
(269, 'GRC0269/2025-26', '1', 'all', '6', '4', '22-05-2025 18:09:02', 'A', 'GRACE CUSTOMER', '', 171.90, 0.00, 0.00, 0.00, 171.90, NULL, NULL, '5', '', '', '', NULL, '', '', '', '', '', '', '', '2025-05-22'),
(270, 'GRC0270/2025-26', '1', 'all', '7', '4', '23-05-2025 15:28:26', 'A', 'GRACE CUSTOMER', '', 144.00, 0.00, 0.00, 0.00, 144.00, NULL, NULL, '6', '', '', '', NULL, '', '', '', '', '', '', '', '2025-05-23'),
(271, 'GRC0271/2025-26', '1', 'all', '6', '4', '23-05-2025 15:30:39', 'A', 'GRACE CUSTOMER', '', 141.00, 0.00, 0.00, 0.00, 141.00, NULL, NULL, '5', '', '', '', NULL, '', '', '', '', '', '', '', '2025-05-23'),
(272, 'GRC0272/2025-26', '1', 'all', '1', '4', '23-05-2025 15:30:56', 'A', 'GRACE CUSTOMER', '', 59.90, 0.00, 0.00, 0.00, 59.90, NULL, NULL, '6', '', '', '', NULL, '', '', '', '', '', '', '', '2025-05-23'),
(273, 'GRC0273/2025-26', '1', 'all', '3', '4', '23-05-2025 15:31:45', 'A', 'GRACE CUSTOMER', '', 74.00, 0.00, 0.00, 0.00, 74.00, NULL, NULL, '6', '', '', '', NULL, '', '', '', '', '', '', '', '2025-05-23'),
(274, 'GRC0274/2025-26', '1', 'all', '6', '4', '23-05-2025 15:32:39', 'A', 'GRACE CUSTOMER', '', 169.80, 0.00, 0.00, 0.00, 169.80, NULL, NULL, '5', '', '', '', NULL, '', '', '', '', '', '', '', '2025-05-23'),
(275, 'GRC0275/2025-26', '1', 'all', '1', '4', '23-05-2025 15:33:00', 'A', 'GRACE CUSTOMER', '', 20.00, 0.00, 0.00, 0.00, 20.00, NULL, NULL, '6', '', '', '', NULL, '', '', '', '', '', '', '', '2025-05-23'),
(276, 'GRC0276/2025-26', '1', 'all', '6', '4', '23-05-2025 15:34:54', 'A', 'GRACE CUSTOMER', '', 128.00, 0.00, 0.00, 0.00, 128.00, NULL, NULL, '7', '', '', '', NULL, '', '', '', '', '', '', '', '2025-05-23'),
(277, 'GRC0277/2025-26', '1', 'all', '6', '4', '23-05-2025 15:37:43', 'A', 'GRACE CUSTOMER', '', 210.80, 0.00, 0.00, 0.00, 210.80, NULL, NULL, '5', '', '', '', NULL, '', '', '', '', '', '', '', '2025-05-23'),
(278, 'GRC0278/2025-26', '1', 'all', '1', '4', '23-05-2025 15:38:30', 'A', 'GRACE CUSTOMER', '', 19.00, 0.00, 0.00, 0.00, 19.00, NULL, NULL, '5', '', '', '', NULL, '', '', '', '', '', '', '', '2025-05-23'),
(279, 'GRC0279/2025-26', '1', 'all', '2', '4', '23-05-2025 15:47:27', 'A', 'GRACE CUSTOMER', '', 58.00, 0.00, 0.00, 0.00, 58.00, NULL, NULL, '5', '', '', '', NULL, '', '', '', '', '', '', '', '2025-05-23'),
(280, 'GRC0280/2025-26', '1', 'all', '13', '4', '24-05-2025 13:22:59', 'A', 'GRACE CUSTOMER', '', 261.90, 0.00, 0.00, 0.00, 261.90, NULL, NULL, '5', '', '', '', NULL, '', '', '', '', '', '', '', '2025-05-24'),
(281, 'GRC0281/2025-26', '1', 'all', '1', '4', '24-05-2025 13:23:50', 'A', 'GRACE CUSTOMER', '', 20.00, 0.00, 0.00, 0.00, 20.00, NULL, NULL, '6', '', '', '', NULL, '', '', '', '', '', '', '', '2025-05-24'),
(282, 'GRC0282/2025-26', '1', 'all', '9', '4', '24-05-2025 13:26:00', 'A', 'GRACE CUSTOMER', '', 186.00, 0.00, 0.00, 0.00, 186.00, NULL, NULL, '5', '', '', '', NULL, '', '', '', '', '', '', '', '2025-05-24'),
(283, 'GRC0283/2025-26', '1', 'all', '5', '4', '24-05-2025 13:27:08', 'A', 'GRACE CUSTOMER', '', 163.70, 0.00, 0.00, 0.00, 163.70, NULL, NULL, '6', '', '', '', NULL, '', '', '', '', '', '', '', '2025-05-24'),
(284, 'GRC0284/2025-26', '1', 'all', '6', '4', '24-05-2025 13:31:30', 'A', 'GRACE CUSTOMER', '', 120.00, 0.00, 0.00, 0.00, 120.00, NULL, NULL, '6', '', '', '', NULL, '', '', '', '', '', '', '', '2025-05-24'),
(285, 'GRC0285/2025-26', '1', 'all', '3', '4', '24-05-2025 13:32:27', 'A', 'GRACE CUSTOMER', '', 78.90, 0.00, 0.00, 0.00, 78.90, NULL, NULL, '6', '', '', '', NULL, '', '', '', '', '', '', '', '2025-05-24'),
(286, 'GRC0286/2025-26', '1', 'all', '4', '4', '24-05-2025 13:33:08', 'A', 'GRACE CUSTOMER', '', 91.00, 0.00, 0.00, 0.00, 91.00, NULL, NULL, '5', '', '', '', NULL, '', '', '', '', '', '', '', '2025-05-24'),
(287, 'GRC0287/2025-26', '1', 'all', '3', '4', '24-05-2025 13:34:42', 'A', 'GRACE CUSTOMER', '', 54.00, 0.00, 0.00, 0.00, 54.00, NULL, NULL, '5', '', '', '', NULL, '', '', '', '', '', '', '', '2025-05-24'),
(288, 'GRC0288/2025-26', '1', 'all', '8', '4', '24-05-2025 13:38:24', 'A', 'GRACE CUSTOMER', '', 177.90, 0.00, 0.00, 0.00, 177.90, NULL, NULL, '5', '', '', '', NULL, '', '', '', '', '', '', '', '2025-05-24'),
(289, 'GRC0289/2025-26', 'all', '1', '200', '1', '24-05-2025 13:59:17', 'A', 'GRACE CUSTOMER', '', 4084.00, 0.00, 0.00, 0.00, 4084.00, NULL, NULL, '', '', '', '', NULL, '', '', '', '', '', '', '', '2025-05-24'),
(290, 'GRC0290/2025-26', '1', 'all', '3', '4', '24-05-2025 14:27:09', 'A', 'GRACE CUSTOMER', '', 64.00, 0.00, 0.00, 0.00, 64.00, NULL, NULL, '5', '', '', '', NULL, '', '', '', '', '', '', '', '2025-05-24'),
(291, 'GRC0290/2025-26', '1', 'all', '3', '4', '24-05-2025 14:27:13', 'A', 'GRACE CUSTOMER', '', 64.00, 0.00, 0.00, 0.00, 64.00, NULL, NULL, '5', '', '', '', NULL, '', '', '', '', '', '', '', '2025-05-24'),
(292, 'GRC0290/2025-26', '1', 'all', '3', '4', '24-05-2025 14:27:09', 'A', 'GRACE CUSTOMER', '', 64.00, 0.00, 0.00, 0.00, 64.00, NULL, NULL, '5', '', '', '', NULL, '', '', '', '', '', '', '', '2025-05-24'),
(293, 'GRC0293/2025-26', '1', 'all', '9', '4', '24-05-2025 18:34:15', 'A', 'GRACE CUSTOMER', '', 202.90, 0.00, 0.00, 0.00, 202.90, NULL, NULL, '5', '', '', '', NULL, '', '', '', '', '', '', '', '2025-05-24'),
(294, 'GRC0294/2025-26', '1', 'all', '7', '4', '24-05-2025 18:35:27', 'A', 'GRACE CUSTOMER', '', 136.00, 0.00, 0.00, 0.00, 136.00, NULL, NULL, '5', '', '', '', NULL, '', '', '', '', '', '', '', '2025-05-24'),
(295, 'GRC0295/2025-26', '1', 'all', '9', '4', '24-05-2025 18:36:59', 'A', 'GRACE CUSTOMER', '', 207.90, 0.00, 0.00, 0.00, 207.90, NULL, NULL, '5', '', '', '', NULL, '', '', '', '', '', '', '', '2025-05-24'),
(296, 'GRC0296/2025-26', '1', 'all', '5', '4', '24-05-2025 18:37:52', 'A', 'GRACE CUSTOMER', '', 108.90, 0.00, 0.00, 0.00, 108.90, NULL, NULL, '7', '', '', '', NULL, '', '', '', '', '', '', '', '2025-05-24'),
(297, 'GRC0297/2025-26', '1', 'all', '6', '4', '24-05-2025 18:38:55', 'A', 'GRACE CUSTOMER', '', 126.00, 0.00, 0.00, 0.00, 126.00, NULL, NULL, '7', '', '', '', NULL, '', '', '', '', '', '', '', '2025-05-24'),
(298, 'GRC0298/2025-26', '1', 'all', '3', '4', '24-05-2025 18:39:28', 'A', 'GRACE CUSTOMER', '', 82.80, 0.00, 0.00, 0.00, 82.80, NULL, NULL, '7', '', '', '', NULL, '', '', '', '', '', '', '', '2025-05-24'),
(299, 'GRC0299/2025-26', '1', 'all', '3', '4', '24-05-2025 18:49:24', 'A', 'GRACE CUSTOMER', '', 66.00, 0.00, 0.00, 0.00, 66.00, NULL, NULL, '5', '', '', '', NULL, '', '', '', '', '', '', '', '2025-05-24'),
(300, 'GRC0300/2025-26', '1', 'all', '1', '4', '25-05-2025 08:03:07', 'A', 'GRACE CUSTOMER', '', 29.90, 0.00, 0.00, 0.00, 29.90, NULL, NULL, '5', '', '', '', NULL, '', '', '', '', '', '', '', '2025-05-25'),
(301, 'GRC0301/2025-26', '1', 'all', '7', '4', '25-05-2025 09:21:55', 'A', 'GRACE CUSTOMER', '', 222.90, 0.00, 0.00, 0.00, 222.90, NULL, NULL, '6', '', '', '', NULL, '', '', '', '', '', '', '', '2025-05-25'),
(302, 'GRC0302/2025-26', '1', 'all', '7', '4', '25-05-2025 12:26:34', 'A', 'GRACE CUSTOMER', '', 162.90, 0.00, 0.00, 0.00, 162.90, NULL, NULL, '6', '', '', '', NULL, '', '', '', '', '', '', '', '2025-05-25'),
(303, 'GRC0303/2025-26', '1', 'all', '9', '4', '25-05-2025 12:37:05', 'A', 'GRACE CUSTOMER', '', 217.90, 0.00, 0.00, 0.00, 217.90, NULL, NULL, '5', '', '', '', NULL, '', '', '', '', '', '', '', '2025-05-25'),
(304, 'GRC0304/2025-26', '1', 'all', '10', '4', '25-05-2025 12:57:19', 'A', 'GRACE CUSTOMER', '', 240.80, 0.00, 0.00, 0.00, 240.80, NULL, NULL, '6', '', '', '', NULL, '', '', '', '', '', '', '', '2025-05-25'),
(305, 'GRC0305/2025-26', '1', 'all', '2', '4', '25-05-2025 12:58:07', 'A', 'GRACE CUSTOMER', '', 49.00, 0.00, 0.00, 0.00, 49.00, NULL, NULL, '6', '', '', '', NULL, '', '', '', '', '', '', '', '2025-05-25'),
(306, 'GRC0306/2025-26', '1', 'all', '4', '4', '25-05-2025 13:25:05', 'A', 'GRACE CUSTOMER', '', 86.00, 0.00, 0.00, 0.00, 86.00, NULL, NULL, '6', '', '', '', NULL, '', '', '', '', '', '', '', '2025-05-25'),
(307, 'GRC0307/2025-26', '1', 'all', '13', '4', '25-05-2025 18:31:20', 'A', 'GRACE CUSTOMER', '', 270.90, 0.00, 0.00, 0.00, 270.90, NULL, NULL, '5', '', '', '', NULL, '', '', '', '', '', '', '', '2025-05-25'),
(308, 'GRC0308/2025-26', '1', 'all', '5', '4', '25-05-2025 18:33:12', 'A', 'GRACE CUSTOMER', '', 99.00, 0.00, 0.00, 0.00, 99.00, NULL, NULL, '5', '', '', '', NULL, '', '', '', '', '', '', '', '2025-05-25'),
(309, 'GRC0309/2025-26', '1', 'all', '18', '4', '25-05-2025 18:36:51', 'A', 'GRACE CUSTOMER', '', 442.90, 0.00, 0.00, 0.00, 442.90, NULL, NULL, '5', '', '', '', NULL, '', '', '', '', '', '', '', '2025-05-25'),
(310, 'GRC0310/2025-26', '1', 'all', '7', '4', '25-05-2025 18:38:05', 'A', 'GRACE CUSTOMER', '', 162.90, 0.00, 0.00, 0.00, 162.90, NULL, NULL, '5', '', '', '', NULL, '', '', '', '', '', '', '', '2025-05-25'),
(311, 'GRC0311/2025-26', '1', 'all', '8', '4', '25-05-2025 18:40:21', 'A', 'GRACE CUSTOMER', '', 154.00, 0.00, 0.00, 0.00, 154.00, NULL, NULL, '7', '', '', '', NULL, '', '', '', '', '', '', '', '2025-05-25'),
(312, 'GRC0312/2025-26', '1', 'all', '12', '4', '29-05-2025 09:33:55', 'A', 'GRACE CUSTOMER', '', 258.00, 0.00, 0.00, 0.00, 258.00, NULL, NULL, '7', '', '', '', NULL, '', '', '', '', '', '', '', '2025-05-29'),
(313, 'GRC0313/2025-26', '1', 'all', '15', '4', '29-05-2025 09:48:34', 'A', 'GRACE CUSTOMER', '', 325.80, 0.00, 0.00, 0.00, 325.80, NULL, NULL, '7', '', '', '', NULL, '', '', '', '', '', '', '', '2025-05-29'),
(314, 'GRC0314/2025-26', '1', 'all', '20', '4', '29-05-2025 10:03:33', 'A', 'GRACE CUSTOMER', '', 459.70, 0.00, 0.00, 0.00, 459.70, NULL, NULL, '7', '', '', '', NULL, '', '', '', '', '', '', '', '2025-05-29'),
(315, 'GRC0315/2025-26', '1', 'all', '3', '4', '30-05-2025 12:08:16', 'A', 'GRACE CUSTOMER', '', 58.00, 0.00, 0.00, 0.00, 58.00, NULL, NULL, '7', '', '', '', NULL, '', '', '', '', '', '', '', '2025-05-30'),
(316, 'GRC0316/2025-26', '1', 'all', '20', '4', '30-05-2025 12:19:52', 'A', 'GRACE CUSTOMER', '', 470.70, 0.00, 0.00, 0.00, 470.70, NULL, NULL, '7', '', '', '', NULL, '', '', '', '', '', '', '', '2025-05-30'),
(317, 'GRC0317/2025-26', '1', 'all', '16', '4', '30-05-2025 12:30:01', 'A', 'GRACE CUSTOMER', '', 452.70, 0.00, 0.00, 0.00, 452.70, NULL, NULL, '7', '', '', '', NULL, '', '', '', '', '', '', '', '2025-05-30'),
(318, 'GRC0318/2025-26', '1', 'all', '17', '4', '30-05-2025 12:43:23', 'A', 'GRACE CUSTOMER', '', 362.70, 0.00, 0.00, 0.00, 362.70, NULL, NULL, '7', '', '', '', NULL, '', '', '', '', '', '', '', '2025-05-30'),
(319, 'GRC0319/2025-26', '1', 'all', '18', '4', '30-05-2025 12:54:14', 'A', 'GRACE CUSTOMER', '', 508.70, 0.00, 0.00, 0.00, 508.70, NULL, NULL, '7', '', '', '', NULL, '', '', '', '', '', '', '', '2025-05-30'),
(320, 'GRC0320/2025-26', '1', 'all', '3', '4', '02-06-2025 15:16:40', 'A', 'GRACE CUSTOMER', '', 68.00, 0.00, 0.00, 0.00, 68.00, NULL, NULL, '5', '', '', '', NULL, '', '', '', '', '', '', '', '2025-06-02'),
(321, 'GRC0321/2025-26', '1', 'all', '10', '4', '02-06-2025 15:22:25', 'A', 'GRACE CUSTOMER', '', 213.00, 0.00, 0.00, 0.00, 213.00, NULL, NULL, '6', '', '', '', NULL, '', '', '', '', '', '', '', '2025-06-02'),
(322, 'GRC0322/2025-26', '1', 'all', '7', '4', '02-06-2025 15:23:23', 'A', 'GRACE CUSTOMER', '', 150.90, 0.00, 0.00, 0.00, 150.90, NULL, NULL, '7', '', '', '', NULL, '', '', '', '', '', '', '', '2025-06-02'),
(323, 'GRC0323/2025-26', '1', 'all', '2', '4', '02-06-2025 15:24:56', 'A', 'GRACE CUSTOMER', '', 40.00, 0.00, 0.00, 0.00, 40.00, NULL, NULL, '5', '', '', '', NULL, '', '', '', '', '', '', '', '2025-06-02'),
(324, 'GRC0324/2025-26', '1', 'all', '7', '4', '02-06-2025 15:28:53', 'A', 'GRACE CUSTOMER', '', 152.00, 0.00, 0.00, 0.00, 152.00, NULL, NULL, '5', '', '', '', NULL, '', '', '', '', '', '', '', '2025-06-02'),
(325, 'GRC0325/2025-26', '1', 'all', '9', '4', '02-06-2025 15:30:34', 'A', 'GRACE CUSTOMER', '', 186.00, 0.00, 0.00, 0.00, 186.00, NULL, NULL, '6', '', '', '', NULL, '', '', '', '', '', '', '', '2025-06-02'),
(326, 'GRC0326/2025-26', '1', 'all', '5', '4', '02-06-2025 15:31:27', 'A', 'GRACE CUSTOMER', '', 96.00, 0.00, 0.00, 0.00, 96.00, NULL, NULL, '7', '', '', '', NULL, '', '', '', '', '', '', '', '2025-06-02'),
(327, 'GRC0327/2025-26', '1', 'all', '6', '4', '02-06-2025 15:32:30', 'A', 'GRACE CUSTOMER', '', 174.90, 0.00, 0.00, 0.00, 174.90, NULL, NULL, '6', '', '', '', NULL, '', '', '', '', '', '', '', '2025-06-02'),
(328, 'GRC0328/2025-26', '1', 'all', '5', '4', '02-06-2025 15:33:48', 'A', 'GRACE CUSTOMER', '', 107.00, 0.00, 0.00, 0.00, 107.00, NULL, NULL, '5', '', '', '', NULL, '', '', '', '', '', '', '', '2025-06-02'),
(329, 'GRC0329/2025-26', '1', 'all', '7', '4', '02-06-2025 15:34:52', 'A', 'GRACE CUSTOMER', '', 151.00, 0.00, 0.00, 0.00, 151.00, NULL, NULL, '6', '', '', '', NULL, '', '', '', '', '', '', '', '2025-06-02'),
(330, 'GRC0330/2025-26', '1', 'all', '9', '4', '02-06-2025 15:36:46', 'A', 'GRACE CUSTOMER', '', 291.50, 0.00, 0.00, 0.00, 291.50, NULL, NULL, '6', '', '', '', NULL, '', '', '', '', '', '', '', '2025-06-02'),
(331, 'GRC0331/2025-26', '1', 'all', '9', '4', '02-06-2025 15:39:54', 'A', 'GRACE CUSTOMER', '', 306.80, 0.00, 0.00, 0.00, 306.80, NULL, NULL, '6', '', '', '', NULL, '', '', '', '', '', '', '', '2025-06-02'),
(332, 'GRC0332/2025-26', '1', 'all', '5', '4', '02-06-2025 17:25:59', 'A', 'GRACE CUSTOMER', '', 112.00, 0.00, 0.00, 0.00, 112.00, NULL, NULL, '6', '', '', '', NULL, '', '', '', '', '', '', '', '2025-06-02'),
(333, 'GRC0333/2025-26', '1', 'all', '6', '4', '02-06-2025 17:55:06', 'A', 'GRACE CUSTOMER', '', 124.90, 0.00, 0.00, 0.00, 124.90, NULL, NULL, '5', '', '', '', NULL, '', '', '', '', '', '', '', '2025-06-02'),
(334, 'GRC0334/2025-26', '1', 'all', '7', '4', '02-06-2025 17:56:39', 'A', 'GRACE CUSTOMER', '', 146.00, 0.00, 0.00, 0.00, 146.00, NULL, NULL, '7', '', '', '', NULL, '', '', '', '', '', '', '', '2025-06-02'),
(335, 'GRC0335/2025-26', '1', 'all', '5', '4', '02-06-2025 17:58:00', 'A', 'GRACE CUSTOMER', '', 97.90, 0.00, 0.00, 0.00, 97.90, NULL, NULL, '6', '', '', '', NULL, '', '', '', '', '', '', '', '2025-06-02'),
(336, 'GRC0336/2025-26', '1', 'all', '3', '4', '02-06-2025 17:59:19', 'A', 'GRACE CUSTOMER', '', 68.00, 0.00, 0.00, 0.00, 68.00, NULL, NULL, '6', '', '', '', NULL, '', '', '', '', '', '', '', '2025-06-02'),
(337, 'GRC0337/2025-26', '1', 'all', '9', '4', '02-06-2025 18:01:48', 'A', 'GRACE CUSTOMER', '', 200.00, 0.00, 0.00, 0.00, 200.00, NULL, NULL, '5', '', '', '', NULL, '', '', '', '', '', '', '', '2025-06-02'),
(338, 'GRC0338/2025-26', '1', 'all', '8', '4', '02-06-2025 18:06:06', 'A', 'GRACE CUSTOMER', '', 200.90, 0.00, 0.00, 0.00, 200.90, NULL, NULL, '5', '', '', '', NULL, '', '', '', '', '', '', '', '2025-06-02'),
(339, 'GRC0339/2025-26', '1', 'all', '5', '4', '02-06-2025 18:16:37', 'A', 'GRACE CUSTOMER', '', 131.70, 0.00, 0.00, 0.00, 131.70, NULL, NULL, '5', '', '', '', NULL, '', '', '', '', '', '', '', '2025-06-02'),
(340, 'GRC0340/2025-26', '1', 'all', '4', '4', '02-06-2025 18:18:00', 'A', 'GRACE CUSTOMER', '', 125.00, 0.00, 0.00, 0.00, 125.00, NULL, NULL, '7', '', '', '', NULL, '', '', '', '', '', '', '', '2025-06-02'),
(341, 'GRC0341/2025-26', '1', 'all', '4', '4', '02-06-2025 18:18:43', 'A', 'GRACE CUSTOMER', '', 69.00, 0.00, 0.00, 0.00, 69.00, NULL, NULL, '5', '', '', '', NULL, '', '', '', '', '', '', '', '2025-06-02'),
(342, 'GRC0342/2025-26', '1', 'all', '10', '4', '02-06-2025 18:20:24', 'A', 'GRACE CUSTOMER', '', 315.50, 0.00, 0.00, 0.00, 315.50, NULL, NULL, '5', '', '', '', NULL, '', '', '', '', '', '', '', '2025-06-02'),
(343, 'GRC0343/2025-26', '1', 'all', '6', '4', '02-06-2025 18:21:50', 'A', 'GRACE CUSTOMER', '', 149.00, 0.00, 0.00, 0.00, 149.00, NULL, NULL, '6', '', '', '', NULL, '', '', '', '', '', '', '', '2025-06-02'),
(344, 'GRC0344/2025-26', '1', 'all', '5', '4', '02-06-2025 18:22:41', 'A', 'GRACE CUSTOMER', '', 116.90, 0.00, 0.00, 0.00, 116.90, NULL, NULL, '6', '', '', '', NULL, '', '', '', '', '', '', '', '2025-06-02'),
(345, 'GRC0345/2025-26', '1', 'all', '7', '4', '02-06-2025 18:23:58', 'A', 'GRACE CUSTOMER', '', 136.00, 0.00, 0.00, 0.00, 136.00, NULL, NULL, '6', '', '', '', NULL, '', '', '', '', '', '', '', '2025-06-02'),
(346, 'GRC0346/2025-26', '1', 'all', '8', '4', '02-06-2025 18:25:52', 'A', 'GRACE CUSTOMER', '', 228.80, 0.00, 0.00, 0.00, 228.80, NULL, NULL, '5', '', '', '', NULL, '', '', '', '', '', '', '', '2025-06-02'),
(347, 'GRC0347/2025-26', '1', 'all', '6', '4', '02-06-2025 18:34:13', 'A', 'GRACE CUSTOMER', '', 201.80, 0.00, 0.00, 0.00, 201.80, NULL, NULL, '5', '', '', '', NULL, '', '', '', '', '', '', '', '2025-06-02'),
(348, 'GRC0348/2025-26', '1', 'all', '16', '4', '03-06-2025 08:04:00', 'A', 'GRACE CUSTOMER', '', 392.70, 0.00, 0.00, 0.00, 392.70, NULL, NULL, '5', '', '', '', NULL, '', '', '', '', '', '', '', '2025-06-03'),
